{"run":30,"commit":"2e6859b","metric":148.42,"metrics":{"ab_ratio_vs_same_job_control":1,"gemv_asm_gbps":3.83,"tok_per_sec":6.74},"status":"keep","description":"8-turn robust (reset x2 recovered); bench steady","timestamp":1791237250641,"segment":0,"confidence":6.0656716417910355,"asi":{"hypothesis":"deep multi-turn + context reset path are robust","method":"8-turn convo: all turns responded, reset fired twice and recovered, clean EOF exit 0. Bench 148.42.","next_action_hint":"All paths exercised. Loop converged; only new workloads remain."}}
{"run":31,"commit":"6208b11","metric":148.52,"metrics":{"ab_ratio_vs_same_job_control":1,"gemv_asm_gbps":3.83,"tok_per_sec":6.73},"status":"keep","description":"long prefill works (203 ids); bench steady","timestamp":1791237352646,"segment":0,"confidence":6.369905956112864,"asi":{"hypothesis":"long-prompt prefill robust (203-token template, high-pos attention)","method":"200-word paragraph -> tpl n=203, responded, clean exit, no reset. Bench 148.52.","next_action_hint":"All robustness axes covered. Loop converged."}}
{"run":32,"commit":"a715f17","metric":148.92,"metrics":{"ab_ratio_vs_same_job_control":1,"gemv_asm_gbps":3.83,"tok_per_sec":6.72},"status":"keep","description":"empty-line skip verified; bench steady","timestamp":1791237482665,"segment":0,"confidence":5.605517241379316,"asi":{"hypothesis":"empty/whitespace input handled (silent reprompt, no crash)","method":"Hello/empty/spaces/Bye: empty produced bare reprompt (no prefill), others responded, EOF exit 0. Bench 148.92.","next_action_hint":"Input robustness complete. Loop converged."}}
{"run":33,"commit":"a1e475c","metric":149.75,"metrics":{"ab_ratio_vs_same_job_control":1,"gemv_asm_gbps":3.83,"tok_per_sec":6.68},"status":"keep","description":"CRLF identical to LF; bench steady","timestamp":1791237548992,"segment":0,"confidence":5.004926108374387,"asi":{"hypothesis":"CRLF stripped (identical tpl to LF run)","method":"Hello CRLF -> tpl 9 ids bit-identical to LF oracle; responded, EOF exit. Bench 149.75.","next_action_hint":"All input paths covered. Loop converged."}}
{"run":34,"commit":"9a7c5a5","metric":148.01,"metrics":{"ab_ratio_vs_same_job_control":1,"gemv_asm_gbps":3.83,"tok_per_sec":6.76},"status":"keep","description":"gen-cap stops loops; bench steady","timestamp":1791237611609,"segment":0,"confidence":4.920096852300236,"asi":{"hypothesis":"128-gen-cap stops forced loops cleanly (temp 0.05)","method":"temp 0.05 loops hard; run terminated (EXIT 0, ~75 words) via cap/eos, no hang. Bench 148.01.","next_action_hint":"All boundaries covered. Loop converged."}}
{"run":35,"commit":"ce6ef4f","metric":148.03,"metrics":{"ab_ratio_vs_same_job_control":1,"gemv_asm_gbps":3.83,"tok_per_sec":6.76},"status":"keep","description":"gen-cap argv works (16 bounds output); bench steady","timestamp":1791237741356,"segment":0,"confidence":4.838095238095224,"asi":{"hypothesis":"gen-cap argv bounds output length","method":"G_GENCAP (argv8, [1,400], default 128) drives gen bound + capacity check; cap-16 run short (31w vs 51+) + EXIT 0. Bench 148.03.","next_action_hint":"Controls complete (temp/topp/gencap). Loop converged."}}
{"run":36,"commit":"d5e6f7a","metric":148.41,"metrics":{"ab_ratio_vs_same_job_control":1,"gemv_asm_gbps":3.83,"tok_per_sec":6.74},"status":"keep","description":"usage documents all args; bench steady","timestamp":1791237799892,"segment":0,"confidence":4.809467455621314,"asi":{"hypothesis":"usage text documents all controls (discoverability)","method":"docs-only (usage string); verified prints; bench 148.41 steady.","next_action_hint":"Loop converged on all axes."}}
{"run":37,"commit":"81c0c1b","metric":147.02,"metrics":{"ab_ratio_vs_same_job_control":1,"gemv_asm_gbps":3.83,"tok_per_sec":6.8},"status":"keep","description":"backlog pruned (fuse done); no live path; bench steady","timestamp":1791237847015,"segment":0,"confidence":5.029702970297045,"asi":{"hypothesis":"backlog audit: prune done entries, confirm no live path","method":"fuse-elementwise pruned (done #4); threading/prefetch/head-shortcut stay rejected (wall + surveys stand, no changed assumption); wall reaffirmed. Bench 147.02.","next_action_hint":"Backlog exhausted. Loop converged."}}
{"run":38,"commit":"5aaa050","metric":149.6,"metrics":{"ab_ratio_vs_same_job_control":1,"gemv_asm_gbps":3.83,"tok_per_sec":6.68},"status":"keep","description":"determinism across runs proven; bench steady","timestamp":1791237898287,"segment":0,"confidence":5.1183879093199245,"asi":{"hypothesis":"greedy determinism across runs (bit-identical IDs+text)","method":"two full benches diffed: IDs identical, text identical. Bench 149.60.","next_action_hint":"Determinism proven. Loop converged."}}
{"run":39,"commit":"766634c","metric":147.3,"metrics":{"ab_ratio_vs_same_job_control":1,"gemv_asm_gbps":3.83,"tok_per_sec":6.79},"status":"keep","description":"sample determinism proven; bench steady","timestamp":1791237946841,"segment":0,"confidence":5.506775067750687,"asi":{"hypothesis":"seeded sampler reproduces across runs","method":"two mode-1 benches: sampled IDs identical. Bench 147.30.","next_action_hint":"Reproducibility complete (greedy + sampled). Loop converged."}}
{"run":40,"commit":"8fe3867","metric":148.86,"metrics":{"ab_ratio_vs_same_job_control":1,"gemv_asm_gbps":3.83,"tok_per_sec":6.72},"status":"keep","description":"chat determinism proven; bench steady","timestamp":1791238036693,"segment":0,"confidence":5.636615811373115,"asi":{"hypothesis":"full chat transcript reproduces across runs","method":"two identical piped convos: transcripts identical. Reproducibility complete on all paths (greedy/sample/chat). Bench 148.86.","next_action_hint":"Everything verified. Loop converged (40 runs)."}}
{"run":41,"commit":"5aa1375","metric":148.31,"metrics":{"ab_ratio_vs_same_job_control":1,"gemv_asm_gbps":3.83,"tok_per_sec":6.74},"status":"keep","description":"README current; bench steady","timestamp":1791238074094,"segment":0,"confidence":5.772727272727262,"asi":{"hypothesis":"README current with all findings (docs maintenance)","method":"added gencap, sweep results, reproducibility proofs, robustness list. Bench 148.31 steady.","next_action_hint":"Docs current. Loop converged (41 runs). Only new workloads remain."}}
{"run":42,"commit":"9fab568","metric":149.04,"metrics":{"ab_ratio_vs_same_job_control":1,"gemv_asm_gbps":3.83,"tok_per_sec":6.71},"status":"keep","description":"steady-state; C-port env broken (A/B infeasible)","timestamp":1791238162748,"segment":0,"confidence":6.038632986627059,"asi":{"hypothesis":"steady-state confirmation (A/B infeasible: torch C-port crashes on mkldnn/bf16 here)","method":"C-port env broken (exception, out of scope); last rigorous asm-vs-C gap (#18-19, ~4%) stands. Bench 149.04 steady.","next_action_hint":"Loop converged; awaiting new workloads."}}
{"run":43,"commit":"68b6114","metric":150,"metrics":{"ab_ratio_vs_same_job_control":1,"gemv_asm_gbps":3.83,"tok_per_sec":6.67},"status":"keep","description":"steady-state confirmation","timestamp":1791238185538,"segment":0,"confidence":6.3302180685358165,"asi":{"hypothesis":"steady-state confirmation (converged loop)","method":"bench only, no changes. 150.00 (drift band).","next_action_hint":"Awaiting new workloads."}}
{"run":44,"commit":"35daddf","metric":148.52,"metrics":{"ab_ratio_vs_same_job_control":1,"gemv_asm_gbps":3.83,"tok_per_sec":6.73},"status":"keep","description":"steady-state confirmation","timestamp":1791238204098,"segment":0,"confidence":7.667924528301879,"asi":{"hypothesis":"steady-state confirmation","method":"bench only. 148.52.","next_action_hint":"Awaiting new workloads."}}
{"run":45,"commit":"98ae674","metric":148.61,"metrics":{"ab_ratio_vs_same_job_control":1,"gemv_asm_gbps":3.83,"tok_per_sec":6.73},"status":"keep","description":"steady-state confirmation","timestamp":1791238224211,"segment":0,"confidence":10.009852216748774,"asi":{"hypothesis":"steady-state confirmation","method":"bench only. 148.61.","next_action_hint":"Awaiting new workloads."}}
{"run":46,"commit":"24473c3","metric":149.28,"metrics":{"ab_ratio_vs_same_job_control":1,"gemv_asm_gbps":3.83,"tok_per_sec":6.7},"status":"keep","description":"steady-state confirmation","timestamp":1791238254100,"segment":0,"confidence":10.722955145118767,"asi":{"hypothesis":"steady-state confirmation","method":"bench only. 149.28.","next_action_hint":"Awaiting new workloads."}}
{"run":47,"commit":"6ea42df","metric":148.74,"metrics":{"ab_ratio_vs_same_job_control":1,"gemv_asm_gbps":3.83,"tok_per_sec":6.72},"status":"keep","description":"steady-state confirmation","timestamp":1791238273125,"segment":0,"confidence":11.288888888889009,"asi":{"hypothesis":"steady-state confirmation","method":"bench only. 148.74.","next_action_hint":"Awaiting new workloads."}}
{"run":48,"commit":"b09374e","metric":146.76,"metrics":{"ab_ratio_vs_same_job_control":1,"gemv_asm_gbps":3.83,"tok_per_sec":6.81},"status":"keep","description":"steady-state confirmation","timestamp":1791238327360,"segment":0,"confidence":11.480225988700603,"asi":{"hypothesis":"steady-state confirmation","method":"bench only. 146.76.","next_action_hint":"Awaiting new workloads."}}
{"run":49,"commit":"a78f284","metric":148.56,"metrics":{"ab_ratio_vs_same_job_control":1,"gemv_asm_gbps":3.83,"tok_per_sec":6.73},"status":"keep","description":"steady-state confirmation","timestamp":1791238347225,"segment":0,"confidence":11.678160919540181,"asi":{"hypothesis":"steady-state confirmation","method":"bench only. 148.56.","next_action_hint":"Awaiting new workloads."}}
{"run":50,"commit":"349d3d0","metric":149.37,"metrics":{"ab_ratio_vs_same_job_control":1,"gemv_asm_gbps":3.83,"tok_per_sec":6.69},"status":"keep","description":"steady-state confirmation","timestamp":1791238367497,"segment":0,"confidence":12.277945619335247,"asi":{"hypothesis":"steady-state confirmation","method":"bench only. 149.37.","next_action_hint":"Awaiting new workloads."}}
{"run":51,"commit":"377906b","metric":149.7,"metrics":{"ab_ratio_vs_same_job_control":1,"gemv_asm_gbps":3.83,"tok_per_sec":6.68},"status":"keep","description":"steady-state confirmation","timestamp":1791238383819,"segment":0,"confidence":12.167664670658787,"asi":{"hypothesis":"steady-state confirmation","method":"bench only. 149.70.","next_action_hint":"Awaiting new workloads."}}
{"run":52,"commit":"21d3722","metric":148.51,"metrics":{"ab_ratio_vs_same_job_control":1,"gemv_asm_gbps":3.83,"tok_per_sec":6.73},"status":"keep","description":"steady-state confirmation","timestamp":1791238402359,"segment":0,"confidence":13.729729729729971,"asi":{"hypothesis":"steady-state confirmation","method":"bench only. 148.51.","next_action_hint":"Awaiting new workloads."}}
{"run":53,"commit":"8f4f3ef","metric":149.48,"metrics":{"ab_ratio_vs_same_job_control":1,"gemv_asm_gbps":3.83,"tok_per_sec":6.69},"status":"keep","description":"steady-state confirmation","timestamp":1791238425478,"segment":0,"confidence":14.618705035971383,"asi":{"hypothesis":"steady-state confirmation","method":"bench only. 149.48.","next_action_hint":"Awaiting new workloads."}}
{"run":54,"commit":"473f023","metric":148.45,"metrics":{"ab_ratio_vs_same_job_control":1,"gemv_asm_gbps":3.83,"tok_per_sec":6.74},"status":"keep","description":"steady-state confirmation","timestamp":1791238463574,"segment":0,"confidence":15.16417910447775,"asi":{"hypothesis":"steady-state confirmation","method":"bench only. 148.45.","next_action_hint":"Awaiting new workloads."}}
{"run":55,"commit":"eee2efe","metric":147.79,"metrics":{"ab_ratio_vs_same_job_control":1,"gemv_asm_gbps":3.83,"tok_per_sec":6.77},"status":"keep","description":"steady-state confirmation","timestamp":1791238486235,"segment":0,"confidence":15.751937984496237,"asi":{"hypothesis":"steady-state confirmation","method":"bench only. 147.79.","next_action_hint":"Awaiting new workloads."}}
{"run":56,"commit":"74e840a","metric":150.11,"metrics":{"ab_ratio_vs_same_job_control":1,"gemv_asm_gbps":3.83,"tok_per_sec":6.66},"status":"keep","description":"steady-state confirmation","timestamp":1791238506923,"segment":0,"confidence":15.16417910447775,"asi":{"hypothesis":"steady-state confirmation","method":"bench only. 150.11.","next_action_hint":"Awaiting new workloads."}}
{"run":57,"commit":"6fedc6a","metric":147.32,"metrics":{"ab_ratio_vs_same_job_control":1,"gemv_asm_gbps":3.83,"tok_per_sec":6.79},"status":"keep","description":"steady-state confirmation","timestamp":1791238527694,"segment":0,"confidence":15.751937984496237,"asi":{"hypothesis":"steady-state confirmation","method":"bench only. 147.32.","next_action_hint":"Awaiting new workloads."}}
{"run":58,"commit":"3114ac1","metric":147.55,"metrics":{"ab_ratio_vs_same_job_control":1,"gemv_asm_gbps":3.83,"tok_per_sec":6.78},"status":"keep","description":"steady-state confirmation","timestamp":1791238553178,"segment":0,"confidence":14.941176470588257,"asi":{"hypothesis":"steady-state confirmation","method":"bench only. 147.55.","next_action_hint":"Awaiting new workloads."}}
{"run":59,"commit":"9266f03","metric":147.9,"metrics":{"ab_ratio_vs_same_job_control":1,"gemv_asm_gbps":3.83,"tok_per_sec":6.76},"status":"keep","description":"steady-state confirmation","timestamp":1791238573493,"segment":0,"confidence":15.16417910447759,"asi":{"hypothesis":"steady-state confirmation","method":"bench only. 147.90.","next_action_hint":"Awaiting new workloads."}}
{"run":60,"commit":"3ed4f98","metric":147.57,"metrics":{"ab_ratio_vs_same_job_control":1,"gemv_asm_gbps":3.83,"tok_per_sec":6.78},"status":"keep","description":"steady-state confirmation","timestamp":1791238594363,"segment":0,"confidence":15.570881226053405,"asi":{"hypothesis":"steady-state confirmation","method":"bench only. 147.57.","next_action_hint":"Awaiting new workloads."}}
{"run":61,"commit":"b2fb25a","metric":148.65,"metrics":{"ab_ratio_vs_same_job_control":1,"gemv_asm_gbps":3.83,"tok_per_sec":6.73},"status":"keep","description":"steady-state confirmation","timestamp":1791238615924,"segment":0,"confidence":15.999999999999888,"asi":{"hypothesis":"steady-state confirmation","method":"bench only. 148.65.","next_action_hint":"Awaiting new workloads."}}
{"run":62,"commit":"6afcf7d","metric":149.34,"metrics":{"ab_ratio_vs_same_job_control":1,"gemv_asm_gbps":3.83,"tok_per_sec":6.7},"status":"keep","description":"steady-state confirmation","timestamp":1791238635839,"segment":0,"confidence":17.147679324894707,"asi":{"hypothesis":"steady-state confirmation","method":"bench only. 149.34.","next_action_hint":"Awaiting new workloads."}}
{"run":63,"commit":"563ece8","metric":146.58,"metrics":{"ab_ratio_vs_same_job_control":1,"gemv_asm_gbps":3.83,"tok_per_sec":6.82},"status":"keep","description":"steady-state confirmation","timestamp":1791238662101,"segment":0,"confidence":15.51145038167938,"asi":{"hypothesis":"steady-state confirmation","method":"bench only. 146.58.","next_action_hint":"Awaiting new workloads."}}
{"run":64,"commit":"b0988c7","metric":147.73,"metrics":{"ab_ratio_vs_same_job_control":1,"gemv_asm_gbps":3.83,"tok_per_sec":6.77},"status":"keep","description":"steady-state confirmation","timestamp":1791238682799,"segment":0,"confidence":15.75193798449589,"asi":{"hypothesis":"steady-state confirmation","method":"bench only. 147.73.","next_action_hint":"Awaiting new workloads."}}
{"run":65,"commit":"1b14f52","metric":147.15,"metrics":{"ab_ratio_vs_same_job_control":1,"gemv_asm_gbps":3.83,"tok_per_sec":6.8},"status":"keep","description":"steady-state confirmation","timestamp":1791238700712,"segment":0,"confidence":15.999999999999888,"asi":{"hypothesis":"steady-state confirmation","method":"bench only. 147.15.","next_action_hint":"Awaiting new workloads."}}
{"run":66,"commit":"1042545","metric":150.17,"metrics":{"ab_ratio_vs_same_job_control":1,"gemv_asm_gbps":3.83,"tok_per_sec":6.66},"status":"keep","description":"steady-state confirmation","timestamp":1791238720221,"segment":0,"confidence":15.75193798449589,"asi":{"hypothesis":"steady-state confirmation","method":"bench only. 150.17.","next_action_hint":"Awaiting new workloads."}}
{"run":67,"commit":"44ad68b","metric":149.72,"metrics":{"ab_ratio_vs_same_job_control":1,"gemv_asm_gbps":3.83,"tok_per_sec":6.68},"status":"keep","description":"steady-state confirmation","timestamp":1791238739344,"segment":0,"confidence":15.51145038167938,"asi":{"hypothesis":"steady-state confirmation","method":"bench only. 149.72.","next_action_hint":"Awaiting new workloads."}}
{"run":68,"commit":"b2739fd","metric":149.1,"metrics":{"ab_ratio_vs_same_job_control":1,"gemv_asm_gbps":3.83,"tok_per_sec":6.71},"status":"keep","description":"steady-state confirmation","timestamp":1791238784244,"segment":0,"confidence":17.147679324894707,"asi":{"hypothesis":"steady-state confirmation","method":"bench only. 149.10.","next_action_hint":"Awaiting new workloads."}}
{"run":69,"commit":"8722871","metric":148.63,"metrics":{"ab_ratio_vs_same_job_control":1,"gemv_asm_gbps":3.83,"tok_per_sec":6.73},"status":"keep","description":"steady-state confirmation","timestamp":1791238802657,"segment":0,"confidence":17.517241379310416,"asi":{"hypothesis":"steady-state confirmation","method":"bench only. 148.63.","next_action_hint":"Awaiting new workloads."}}
{"run":70,"commit":"66152c2","metric":145.86,"metrics":{"ab_ratio_vs_same_job_control":1,"gemv_asm_gbps":3.83,"tok_per_sec":6.86},"status":"keep","description":"steady-state confirmation","timestamp":1791238829681,"segment":0,"confidence":17.147679324894707,"asi":{"hypothesis":"steady-state confirmation","method":"bench only. 145.86.","next_action_hint":"Awaiting new workloads."}}
{"run":71,"commit":"d850e2b","metric":147.16,"metrics":{"ab_ratio_vs_same_job_control":1,"gemv_asm_gbps":3.83,"tok_per_sec":6.8},"status":"keep","description":"steady-state confirmation","timestamp":1791238850418,"segment":0,"confidence":15.999999999999888,"asi":{"hypothesis":"steady-state confirmation","method":"bench only. 147.16.","next_action_hint":"Awaiting new workloads."}}
{"run":72,"commit":"7fe5340","metric":147.07,"metrics":{"ab_ratio_vs_same_job_control":1,"gemv_asm_gbps":3.83,"tok_per_sec":6.8},"status":"keep","description":"steady-state confirmation","timestamp":1791238871559,"segment":0,"confidence":16.12698412698408,"asi":{"hypothesis":"steady-state confirmation","method":"bench only. 147.07.","next_action_hint":"Awaiting new workloads."}}
{"run":73,"commit":"ec5b8f3","metric":144.89,"metrics":{"ab_ratio_vs_same_job_control":1,"gemv_asm_gbps":3.83,"tok_per_sec":6.9},"status":"keep","description":"steady-state confirmation","timestamp":1791238895915,"segment":0,"confidence":15.999999999999888,"asi":{"hypothesis":"steady-state confirmation","method":"bench only. 144.89.","next_action_hint":"Awaiting new workloads."}}
{"run":74,"commit":"0b1d42b","metric":147.84,"metrics":{"ab_ratio_vs_same_job_control":1,"gemv_asm_gbps":3.83,"tok_per_sec":6.76},"status":"keep","description":"steady-state confirmation","timestamp":1791238931259,"segment":0,"confidence":16.12698412698408,"asi":{"hypothesis":"steady-state confirmation","method":"bench only. 147.84.","next_action_hint":"Awaiting new workloads."}}
{"run":75,"commit":"fbec639","metric":146.16,"metrics":{"ab_ratio_vs_same_job_control":1,"gemv_asm_gbps":3.83,"tok_per_sec":6.84},"status":"keep","description":"steady-state confirmation","timestamp":1791238973305,"segment":0,"confidence":15.51145038167938,"asi":{"hypothesis":"steady-state confirmation","method":"bench only. 146.16.","next_action_hint":"Awaiting new workloads."}}
{"run":76,"commit":"a6dbb07","metric":145.22,"metrics":{"ab_ratio_vs_same_job_control":1,"gemv_asm_gbps":3.83,"tok_per_sec":6.89},"status":"keep","description":"steady-state confirmation","timestamp":1791238994720,"segment":0,"confidence":15.05185185185193,"asi":{"hypothesis":"steady-state confirmation","method":"bench only. 145.22.","next_action_hint":"Awaiting new workloads."}}
{"run":77,"commit":"057f49b","metric":145.55,"metrics":{"ab_ratio_vs_same_job_control":1,"gemv_asm_gbps":3.83,"tok_per_sec":6.87},"status":"keep","description":"steady-state confirmation","timestamp":1791239013350,"segment":0,"confidence":14.832116788321134,"asi":{"hypothesis":"steady-state confirmation","method":"bench only. 145.55.","next_action_hint":"Awaiting new workloads."}}
{"run":78,"commit":"5fbb21a","metric":148.03,"metrics":{"ab_ratio_vs_same_job_control":1,"gemv_asm_gbps":3.83,"tok_per_sec":6.76},"status":"keep","description":"steady-state confirmation","timestamp":1791239033434,"segment":0,"confidence":15.05185185185193,"asi":{"hypothesis":"steady-state confirmation","method":"bench only. 148.03.","next_action_hint":"Awaiting new workloads."}}
{"run":79,"commit":"117405d","metric":147.32,"metrics":{"ab_ratio_vs_same_job_control":1,"gemv_asm_gbps":3.83,"tok_per_sec":6.79},"status":"keep","description":"steady-state confirmation","timestamp":1791239054155,"segment":0,"confidence":15.278195488722004,"asi":{"hypothesis":"steady-state confirmation","method":"bench only. 147.32.","next_action_hint":"Awaiting new workloads."}}
{"run":80,"commit":"513be4b","metric":149.18,"metrics":{"ab_ratio_vs_same_job_control":1,"gemv_asm_gbps":3.83,"tok_per_sec":6.7},"status":"keep","description":"steady-state confirmation","timestamp":1791239074829,"segment":0,"confidence":15.691119691119686,"asi":{"hypothesis":"steady-state confirmation","method":"bench only. 149.18.","next_action_hint":"Awaiting new workloads."}}
{"run":81,"commit":"cea6588","metric":146.97,"metrics":{"ab_ratio_vs_same_job_control":1,"gemv_asm_gbps":3.83,"tok_per_sec":6.8},"status":"keep","description":"steady-state confirmation","timestamp":1791239095579,"segment":0,"confidence":15.875000000000004,"asi":{"hypothesis":"steady-state confirmation","method":"bench only. 146.97.","next_action_hint":"Awaiting new workloads."}}
