{"type":"config","name":"gemma-3-270m ARM decode speed (3-core target)","metricName":"ms_per_token","metricUnit":"ms","bestDirection":"lower"}
{"run":1,"commit":"8efe012","metric":158.83,"metrics":{"tok_per_sec":6.296},"status":"keep","description":"baseline: single-threaded driver, port gates pass, 6.3 tok/s","timestamp":1791209566263,"segment":0,"confidence":null,"asi":{"hypothesis":"single-threaded C+NEON driver baseline; memory-bound at ~540MB weights per token over Pi4 ~4GB/s bus"}}
{"run":2,"commit":"f650c59","metric":165.43,"metrics":{"tok_per_sec":6.0449},"status":"discard","description":"3-thread OpenMP GEMV slower (+4%): memory wall confirmed, reverted","timestamp":1791209720646,"segment":0,"confidence":null,"asi":{"hypothesis":"3-thread static-partition OpenMP GEMV would better saturate Pi4 DRAM bus","next_action_hint":"workload is memory-wall bound (~552MB/token over ~4GB/s bus = 138ms floor; at 159ms already 87% efficient). Next: compiler flags (-O3 -mcpu=cortex-a72) then fuse elementwise passes (scale into scores, G*=U into gelu, residual into norm) to shave non-weight traffic. Threading only revisited if per-token traffic drops.","rollback_reason":"165.43ms vs 158.83ms baseline (+4.2%): extra threads add fork/join + DRAM contention with zero bandwidth headroom; single thread already saturates ~85% of bus"}}
{"run":3,"commit":"fbc5194","metric":158.41,"metrics":{"tok_per_sec":6.3127},"status":"keep","description":"-O3 -mcpu=cortex-a72: 158.41ms (noise-level, kept as new default)","timestamp":1791209862390,"segment":0,"confidence":1,"asi":{"hypothesis":"-O3 -mcpu=cortex-a72 improves unrolling/scheduling/prefetch of streaming NEON kernels","note":"delta 0.42ms (0.26%) is within Pi thermal noise floor; kept because gates pass, outputs bit-identical (parity by construction), and -O3 is directionally the right default. Confidence to be built by subsequent runs."}}
{"run":4,"commit":"f650c59","metric":156.85,"metrics":{"tok_per_sec":6.3757},"status":"keep","description":"fused elementwise passes: 156.85ms (-1.2%), bits identical","timestamp":1791210006045,"segment":0,"confidence":2,"asi":{"hypothesis":"fusing elementwise passes (attn scale, gelu*up, norm+residual, C argmax) removes ~100 numpy/ctypes round-trips per token with identical flops"}}
{"run":5,"commit":"f650c59","metric":157.33,"metrics":{"tok_per_sec":6.3559},"status":"discard","description":"math-errno flags no gain (+0.3% noise), reverted","timestamp":1791210081406,"segment":0,"confidence":1.8333333333333772,"asi":{"hypothesis":"-fno-math-errno -fno-trapping-math speeds tanhf/expf/sqrtf hot spots","next_action_hint":"scalar-math hot spots are negligible; remaining budget is weight traffic (552MB/token) + GEMV kernel efficiency. Next: profile-guided GEMV micro-opts (accumulator count, unroll, prefetch distance) or accept ~91% of bus floor.","rollback_reason":"157.33ms vs 156.85ms incumbent (+0.3%, noise): glibc already inlines or hot spots smaller than estimated; flags add finite-math assumption risk for zero gain"}}
{"run":6,"commit":"f650c59","metric":186.58,"metrics":{"tok_per_sec":5.3597},"status":"discard","description":"software prefetch hurts (+19% both localities), reverted","timestamp":1791210266986,"segment":0,"confidence":1.2941176470588345,"asi":{"hypothesis":"software next-row prefetch hides DRAM latency at page edges","next_action_hint":"HW stride prefetcher already covers the sequential stream; hand hints only add issue-slot/dependency cost. Next: C layer_step to cut ~200 ctypes calls/token, then taskset pinning for measurement hygiene. Squeeze ceiling ~5-7% above current 156.85ms.","rollback_reason":"186.58ms vs 156.85ms (+19%): per-row prefetch address computation + issue cost exceeds any latency hidden, at both localities 3 and 0; HW prefetcher needs no help"}}
{"run":7,"commit":"f650c59","metric":177.61,"metrics":{"ab_ratio_vs_same_job_control":0.957,"tok_per_sec":5.6303},"status":"keep","description":"precomputed tables: -4.3% same-job A/B (177.6 vs 185.4), bits identical; Pi drift noted","timestamp":1791211542068,"segment":0,"confidence":1,"asi":{"hypothesis":"precomputing hot-loop tables (ptrs, shapes, rope bases) removes ~300 dict/format/shape lookups per token","method":"same-job alternating A/B (3x16-token blocks, old vs new) to cancel drift; parity old-vs-new logits IDENTICAL; A/B ratio 0.957","next_action_hint":"Pi performance drifts ~18% over sustained sessions (cause TBD; throttled=0x0). All future decisions must use same-job A/B ratios, not cross-session absolutes. Add SoC temp sampling to bench; consider cooldown pauses between jobs."}}
{"run":8,"commit":"f650c59","metric":139.55,"metrics":{"ab_ratio_vs_same_job_control":0.981,"tok_per_sec":7.1657},"status":"keep","description":"C layer_step: 139.55ms, -1.9% same-job A/B, bits identical","timestamp":1791212235540,"segment":0,"confidence":4.494172494172488,"asi":{"hypothesis":"one ctypes crossing per layer (C layer_step) removes ~180 call overheads per token","method":"same-job A/B ratio 0.981 (138.5 vs 141.2 avg of 3x16 blocks) + official gates+bench run; parity IDENTICAL"}}
{"run":9,"commit":"fcbe727","metric":143.96,"metrics":{"ab_ratio_vs_same_job_control":1.042,"tok_per_sec":6.9464},"status":"discard","description":"OMP retest same-job A/B: +4.2% again, discard confirmed rigorously","timestamp":1791214136731,"segment":0,"confidence":2.7464387464387428,"asi":{"hypothesis":"3-thread static-partition GEMV retest; run #2 predated drift discovery so its +4.2% was unreliable","method":"same-job alternating A/B (3x16 blocks, serial vs OMP) in a separate _omp tree; parity IDENTICAL; serial A/B avg 138.22 vs OMP 143.96","next_action_hint":"Threading closed for good: workload is DRAM-bound (98% of streaming ceiling), threads add only fork/join + contention. Remaining identical-math headroom ~2-3%. Only unexplored lever of size is algorithmic (all surveyed avenues dead). Consider loop pause vs micro-grind.","rollback_reason":"same-job ratio 1.042 (+4.2%, matches #2 exactly): confirms discard with rigor; no ALU slack exists; confirms official serial 138.51 in same conditions"}}
{"run":10,"commit":"fcbe727","metric":138.51,"metrics":{"ab_ratio_vs_same_job_control":1,"gemv_asm_gbps":2.92,"tok_per_sec":7.2198},"status":"keep","description":"asm stage A verified: math exact to 7 digits, GEMV 2.92GB/s (widening gap noted)","timestamp":1791216930549,"segment":0,"confidence":1.8928737773637656,"asi":{"hypothesis":"pure-asm core (SVC-only, libm-free math, NEON GEMV mirroring C order) as the new deliverable path","method":"self-test values vs mathematical truth to 7 digits; GEMV microbench 20x(2048x640) via CNTVCT","next_action_hint":"Stage B: norms/rope/softmax/attn/layer + safetensors mmap + header scan in asm. Known GEMV gap 2.92 vs C 3.84 (uxtl+shl widening; recover via objdump-read USHLL#16 encoding + .inst). Then Stage C: decode loop + BPE + first asm ms/token."}}
{"run":11,"commit":"fcbe727","metric":138.51,"metrics":{"ab_ratio_vs_same_job_control":1,"gemv_asm_gbps":3.88,"tok_per_sec":7.2198},"status":"keep","description":"asm shll widening: GEMV 2.92->3.88GB/s, self-tests exact","timestamp":1791216994074,"segment":0,"confidence":1.5198204936424842,"asi":{"hypothesis":"single-insn SHLL#16 widening (encoding read from gcc's proven-good .so via objdump) removes the uxtl+shl ALU overhead","method":"same 20x(2048x640) CNTVCT microbench; self-tests re-verified exact","next_action_hint":"Stage B: norms/rope/softmax/attn/layer + safetensors mmap + header scan in asm. GEMV now at ceiling; no further micro-opts available. Then Stage C: decode loop + BPE + first asm ms/token."}}
{"run":12,"commit":"fcbe727","metric":138.51,"metrics":{"ab_ratio_vs_same_job_control":1,"gemv_asm_gbps":3.83,"tok_per_sec":7.2198},"status":"keep","description":"asm stage B-1: 236/236 tensors, shapes+values exact","timestamp":1791217484954,"segment":0,"confidence":1.3250733615911334,"asi":{"hypothesis":"pure-asm file stage (SVC open/lseek/mmap + order-proof header scan) locates all tensors","method":"anchors: 236/236 found; embed 262144x640; in_norm0 values match HF-recorded weights exactly; l17_down 640x2048","next_action_hint":"Stage B-2: rmsnorm/rope/softmax/attn asm kernels with self-consistent tests (norm==1, softmax sum==1, rope preserves norm) + real-weight norm check vs recorded qn magnitude. Then B-3: layer loop + RoPE tables + first full forward stats vs HF anchors."}}
{"run":13,"commit":"fcbe727","metric":138.51,"metrics":{"ab_ratio_vs_same_job_control":1,"gemv_asm_gbps":3.83,"tok_per_sec":7.2198},"status":"keep","description":"asm stage B-2: all 9 kernels verified exact","timestamp":1791221504931,"segment":0,"confidence":1.1745664739884416,"asi":{"hypothesis":"nine asm compute kernels verified by exact/self-consistent tests (C-order mirrors)","method":"8/8 green: gemv exact, rmsnorm analytic, rope norm-preserving, softmax sum 1 + argmax, gelu torch value, scores exact, values exact, residual exact; file stage still green","next_action_hint":"Stage B-3: layer loop + RoPE tables + K/V caches + first full forward in asm; compare L0/output stats vs recorded HF anchors (post-o ~98, L16 ~99082). Then Stage C: decode loop + BPE + first asm ms/token. Standing rule: never hold addresses across bl except x19+."}}
{"run":14,"commit":"fcbe727","metric":138.51,"metrics":{"ab_ratio_vs_same_job_control":1,"gemv_asm_gbps":3.83,"tok_per_sec":7.2198},"status":"keep","description":"asm stage B-3a: tables+fold+embed match recorded values","timestamp":1791222197535,"segment":0,"confidence":1.7082807902480037,"asi":{"hypothesis":"RoPE tables (expf-based inv_freq + sincos) + float64 norm folding + embed, all in asm","method":"anchors vs session-recorded values: inv 0.9305720 exact; sliding cos/sin at pos2 match HF buffers to ~1e-7; folded norms bitwise vs f32vec","next_action_hint":"Stage B-3b: layer-0 forward in asm (embed->norm->QKV->rope->attn->MLP) + numpy reference signature comparison. Standing rules: never hold addresses across bl except x19+; watch FP aliasing (sN vs dN low halves) across calls."}}
{"run":15,"commit":"fcbe727","metric":138.51,"metrics":{"ab_ratio_vs_same_job_control":1,"gemv_asm_gbps":3.83,"tok_per_sec":7.2198},"status":"keep","description":"asm layer-0 forward matches numpy to 3e-5, all stages","timestamp":1791222578696,"segment":0,"confidence":3.7284403669724693,"asi":{"hypothesis":"full layer-0 forward in asm (embed->norm->QKV->rope->attn->MLP) matches independent numpy","method":"9 stage signatures (max + 4 lanes): worst diff 3e-5 on O(200) magnitudes; POST/X1/D/X2 identical to 7 digits","next_action_hint":"Stage C: decode loop (K/V caches per layer, pos advance, argmax, token loop) + BPE detokenization (vocab from tokenizer.json) + cntvct timing + first asm ms/token vs 138.51 incumbent."}}
{"run":16,"commit":"fcbe727","metric":143.15,"metrics":{"ab_ratio_vs_same_job_control":1,"gemv_asm_gbps":3.83,"tok_per_sec":6.986},"status":"keep","description":"first pure-asm decode: 143.15ms/token, IDs sane","timestamp":1791224416514,"segment":0,"confidence":4.027750247770061,"asi":{"hypothesis":"first pure-asm end-to-end decode (18 layers, KV caches, greedy, timed) produces correct output at C-port parity speed","method":"32-token greedy decode, 8-token prefill, CNTVCT timing; token IDs sane/in-vocab; L0 signature still matches numpy","next_action_hint":"Close the +3.3% vs C port (143.15 vs 138.51): profile per-layer vs head split; likely GEMV loop structure (hand-asm vs -O3 unroll) or decode-loop overhead. Then BPE detokenization for real text."}}
{"run":17,"commit":"fcbe727","metric":142.51,"metrics":{"ab_ratio_vs_same_job_control":1,"gemv_asm_gbps":3.83,"tok_per_sec":7.0165},"status":"keep","description":"BPE text works, deterministic; 142.51ms/token","timestamp":1791228095740,"segment":0,"confidence":4.3793103448275765,"asi":{"hypothesis":"BPE text display via offline blob + put_surf completes the readable-output path","method":"vocab ids 262144/262144; spots exact (<bos>, newlines, Name); 32-token text displays (degenerate repetition consistent with checkpoint chaos); two runs bit-identical IDs","next_action_hint":"Close +3% vs C port if real (same-job A/B asm-vs-C); then sampler (temp/top-k/top-p) + interactive chat per vision (real demos). Standing: never hold addresses across bl except x19+; watch FP aliasing."}}
{"run":18,"commit":"fcbe727","metric":144.7,"metrics":{"ab_ratio_vs_same_job_control":1.04,"gemv_asm_gbps":3.83,"tok_per_sec":6.91},"status":"discard","description":"A/B: asm 4% slower than C, gap is real; C restype fixed","timestamp":1791230026273,"segment":0,"confidence":4.027750247770061,"asi":{"hypothesis":"asm matches C port speed (the +3% gap was drift)","method":"same-job alternating A/B, 3 rounds each (C via bench_decode, asm via ./core); C driver restype bug fixed en route (correctness, gates re-verified green)","next_action_hint":"Gap is real (~4%, C wins every round). Profile asm GEMV loop vs gcc -O3 (unroll/scheduling/prefetch) to close it. C restype fix is committed and must survive any revert.","rollback_reason":"A/B ratio 1.040 (C 139.09 avg vs asm 144.70 avg, C faster all 3 rounds): gap is structural, not drift. No code change to revert (measurement + bugfix only)."}}
{"run":19,"commit":"fcbe727","metric":143.61,"metrics":{"ab_ratio_vs_same_job_control":1.037,"gemv_asm_gbps":3.85,"tok_per_sec":6.96},"status":"discard","description":"ABBA: gap real, GEMV wash, suspect math kernels","timestamp":1791230913778,"segment":0,"confidence":3.9843137254901824,"asi":{"hypothesis":"the asm-vs-C gap is order bias (C always ran first/cooler)","method":"ABBA order (C,A,A,C): C faster every adjacent pair (avg gap 5.16ms/3.7%); C-GEMV micro (head 3.98, mlp 3.68) vs asm (~3.85 both) nets to ~wash, so gap lives in small-kernel/math path, not GEMV","next_action_hint":"Instrument asm decode sections (attn vs MLP vs head timings) to localize the ~5ms; prime suspect 37K expf/tanhf calls per token (mine vs libm).","rollback_reason":"ABBA confirms gap is real and order-independent; GEMV micro-benchmarks net to ~wash, redirecting focus to math kernels. No code change (measurement only)."}}
{"run":20,"commit":"fcbe727","metric":144.34,"metrics":{"ab_ratio_vs_same_job_control":1.037,"gemv_asm_gbps":3.85,"tok_per_sec":6.93},"status":"discard","description":"math exonerated (expf/tanhf at parity); gap is scheduling","timestamp":1791232409402,"segment":0,"confidence":3.8521327014217803,"asi":{"hypothesis":"the ~4% asm-vs-C gap lives in math kernels (37K expf/tanhf per token)","method":"4M-call microbench in-asm: expf 1.37 ticks (~25ns), tanhf 1.90 ticks (~35ns) — at parity with libm-class speeds; cannot explain 5ms","next_action_hint":"Gap is loop scheduling/pipeline, not math. Deprioritize grind (ceiling-bound, noisy); pivot to sampler (temp/top-k/top-p, xorshift) + interactive chat for real demos per vision. Revisit scheduling only with section-timer proof.","rollback_reason":"math exonerated by direct measurement; remaining gap small, noisy, and structurally expensive to chase. No code change (measurement only)."}}
{"run":21,"commit":"fcbe727","metric":143.45,"metrics":{"ab_ratio_vs_same_job_control":1,"gemv_asm_gbps":3.83,"tok_per_sec":6.97},"status":"keep","description":"sampler works, greedy bit-identical, no slowdown","timestamp":1791233213601,"segment":0,"confidence":3.9843137254901824,"asi":{"hypothesis":"sampler (xorshift64*, temp softmax, top-64/p0.95) adds sampling with zero greedy impact","method":"mode 0 IDs bit-identical to established greedy; mode 1 diverges properly from token 3 (107 vs 108); same fixed seed -> reproducible; greedy 143.45 (no regression)","next_action_hint":"Interactive chat loop (readline via read SVC, multi-turn KV, eos stop) for real demos per vision. Sampler overhead (+35% sampled-only) acceptable; top-k insertion is the cost center if ever optimized."}}
{"run":22,"commit":"0543ad2","metric":143.02,"metrics":{"ab_ratio_vs_same_job_control":1,"gemv_asm_gbps":3.83,"tok_per_sec":6.99},"status":"keep","description":"asm BPE encode 18/18 exact vs HF, no decode slowdown","timestamp":1791234547352,"segment":0,"confidence":4.0478087649402354,"asi":{"hypothesis":"BPE encode in pure asm replicates HF tokenization exactly (space->U+2581, char init, rank-order merges)","method":"18/18 reference strings bit-exact vs HF oracle incl CJK/emoji/controls/spaces; fixed 3 real bugs found by measurement (blob sort order vs u64 key, memmove off-by-one); greedy decode untouched (143.02 vs 143.45)","next_action_hint":"Chat REPL on top of encode: stdin line reader (read SVC), prefill+decode loop, multi-turn KV, eos stop. Then arbitrary-prompt demos."}}
{"run":23,"commit":"e294774","metric":147.97,"metrics":{"ab_ratio_vs_same_job_control":1,"gemv_asm_gbps":3.83,"tok_per_sec":6.76},"status":"keep","description":"chat REPL works (2-turn, EOF, multi-turn); bench within drift","timestamp":1791235548393,"segment":0,"confidence":3.9843137254901824,"asi":{"hypothesis":"interactive chat REPL (readline, prefill, eos stop, multi-turn KV) enables real conversations","method":"2-turn piped convo responds per-turn + clean EOF exit; /dev/null exits; no phantom turns/resets; fixed 2 readline reg bugs (count vs len); bench 147.97 vs 143.02 is heat drift (cooldown trend 150.38->147.97, chat dormant in bench)","next_action_hint":"Real demos: chat template (roles), temp/top-p argv tuning, gen-cap/quality; or document + README. Metric work converged at wall."}}
{"run":24,"commit":"1d3b779","metric":147.21,"metrics":{"ab_ratio_vs_same_job_control":1,"gemv_asm_gbps":3.83,"tok_per_sec":6.79},"status":"keep","description":"chat template bit-exact vs HF oracle; bench steady","timestamp":1791235955039,"segment":0,"confidence":3.8521327014217803,"asi":{"hypothesis":"gemma-3 role template (SOT/EOT) structures chat prefill correctly","method":"tpl id line bit-exact vs HF oracle ([105,2364,107,9259,106,107,105,4368,107]); caught+fixed LE store bug (suer) via transparency print; 2-turn convo + EOF clean; bench 147.21 (drift band, chat dormant)","next_action_hint":"Quality: temp/top-p argv + gen-cap; or README/docs of converged loop. Metric work at wall (98% ceiling)."}}
{"run":25,"commit":"7c25313","metric":146.21,"metrics":{"ab_ratio_vs_same_job_control":1,"gemv_asm_gbps":3.83,"tok_per_sec":6.84},"status":"keep","description":"temp/top-p argv work (0.7/0.5 verified); bench steady","timestamp":1791236657427,"segment":0,"confidence":3.7284403669724693,"asi":{"hypothesis":"temp/top-p argv controls let users tame sampling for demos","method":"G_TEMP/G_TOPP (milli argv, clamped) feed sampler; both verified parsing (0.7/0.5); fixed bench-skip bug (chat branch jumped over defaults); bench 146.21 (drift band, controls dormant in greedy bench)","next_action_hint":"Quality A/B (temp sweep for coherence) or README/docs. Metric converged at wall."}}
{"run":26,"commit":"f941a0a","metric":149.19,"metrics":{"ab_ratio_vs_same_job_control":1,"gemv_asm_gbps":3.83,"tok_per_sec":6.7},"status":"keep","description":"temp sweep: 0.5 loops (distinct4 0.09), >=0.7 diverse (1.00)","timestamp":1791236799066,"segment":0,"confidence":3.8052434456928856,"asi":{"hypothesis":"temp sweep finds coherence sweet spot (repetition measured objectively)","method":"same prompt temps 0.5/0.7/1.0: distinct4 0.09/1.00/1.00, maxrun 66/2/2. Low temp collapses into loops (peaked trap); >=0.7 diverse. Guidance: prefer >=0.7. Bench 149.19 (drift).","next_action_hint":"README/docs write-up of converged loop, or quality follow-ups (top-p sweep, gen-cap). Metric at wall."}}
{"run":27,"commit":"474ea47","metric":147.91,"metrics":{"ab_ratio_vs_same_job_control":1,"gemv_asm_gbps":3.83,"tok_per_sec":6.76},"status":"keep","description":"README write-up; bench confirms steady","timestamp":1791236842978,"segment":0,"confidence":4.189690721649494,"asi":{"hypothesis":"README preserves converged findings durably (no code change)","method":"docs-only: numbers, usage, proven wall, temp guidance, layout. Bench 147.91 confirms nothing broke (drift band).","next_action_hint":"Loop converged: metric at wall (98% ceiling), features complete (BPE/chat/template/controls). Only remaining: quality follow-ups or new workloads."}}
{"run":28,"commit":"9538819","metric":147.65,"metrics":{"ab_ratio_vs_same_job_control":1,"gemv_asm_gbps":3.83,"tok_per_sec":6.77},"status":"keep","description":"top-p sweep neutral (all diverse); default stands","timestamp":1791236937343,"segment":0,"confidence":4.215767634854783,"asi":{"hypothesis":"top-p sweep affects coherence (mirror of temp sweep)","method":"temp 1.0, topp 0.5/0.95/1.0: all distinct4 1.00, maxrun<=2. Length varies (12/35/78 words) but no loops. Top-p neutral here (top-k=64 already bounds); default 0.95 stands. Bench 147.65.","next_action_hint":"Quality levers exhausted (temp>=0.7 only guidance). Loop fully converged; only new workloads remain."}}
{"run":29,"commit":"29dd7db","metric":147.86,"metrics":{"ab_ratio_vs_same_job_control":1,"gemv_asm_gbps":3.83,"tok_per_sec":6.76},"status":"keep","description":"regression green (18/18, greedy identical); bench steady","timestamp":1791236988001,"segment":0,"confidence":4.525612472160352,"asi":{"hypothesis":"converged state still holds (regression: BPE, determinism, bench)","method":"one run: BPE 18/18 vs HF, greedy head bit-identical to established seq, metric 148.77. Formal bench 147.86. No bit-rot.","next_action_hint":"Loop fully converged on all axes. Only new workloads remain."}}
