{"run": 223, "commit": "eeb24da", "metric": 543.43, "metrics": {"ab_ratio_vs_same_job_control": 1, "bpe_tests_passed": 18, "gemv_asm_gbps": 3.68, "tok_per_sec_1b": 1.84, "tok_per_sec_270m": 6.8}, "status": "keep", "description": "gemma-3-1B runs on the same binary: header-driven dims, HF-exact", "timestamp": 1791278298737, "segment": 0, "confidence": 15.0, "asi": {"hypothesis": "migrate the 270m asm engine to gemma-3-1b-it-qat-q4_0 without forking the code", "conclusion": "Done and verified: the engine now derives hidden/intermediate/layer-count/vocab, the folded-norm stride, every kernel dimension, the embed scale and the full-attention set from the safetensors header, so one binary runs 1B, 270m and FunctionGemma. 1B greedy is token-identical to HF (bf16+eager): bench 32/32 and the chat transcript 'The capital of France is **Paris**.'; 1B runs at 543 ms/token (2.00 GB of weights per token at the same ~3.7 GB/s bus saturation as 270m).", "method": "recon (config, buffer sizes, immediate inventory) -> parameterize the loader and the forward path -> regression-test 270m after every step -> localize 1B failures with a layer-0 fp64 oracle and gdb", "findings": "Three real bugs, all of the same shape - a 270m constant surviving the migration: (1) tab[] held 236 entries and 1B needs 340, so the loader overran into neighbouring bss and stopped after 18 of 26 layers; (2) the embedding gather still passed dim=640, so 1B gathered 640 of 1152 elements (garbage output); (3) the residual adds and the debug print lengths were still 640. Also fixed in passing: argmax was handed the G_VOC cell instead of the logits pointer, and five FL-index sites kept an old `lsl #8` that double-scaled the stride. 270m stayed byte-identical throughout (dims print, L0 block, bench ids, chat answer) and matches the fp64 oracle at 144 layer x position pairs to 1.7e-6.", "next_action_hint": "Demos and README now cover 1B + 270m + FunctionGemma. Next candidate: the same binary against gemma-3-4b (hidden 2560, 34 layers, inter 10240) - buffer sizes in bss would need raising again, and 4B fp32 will not fit the Pi's RAM."}}
{"run": 224, "commit": "6e27d37", "metric": 543.43, "metrics": {"ab_ratio_vs_same_job_control": 1, "gemv_asm_gbps": 3.68, "tok_per_sec_1b": 1.84}, "status": "keep", "description": "1B ceiling map; demos re-shot with the hardest prompts it answers correctly", "timestamp": 1791281674515, "segment": 0, "confidence": 15.2, "asi": {"hypothesis": "find the most complex prompt gemma-3-1B answers correctly and demo that instead of an easy one", "conclusion": "Ceiling is a structured multi-item answer with one fact per item: EN 'List the four seasons and one thing that changes in each.' (complete, 4/4 correct, plus a closing line) and zh-TW '請列出保持健康的三個要點。' (3 detailed, correct tips). Both clips re-shot with these; gen caps tuned (123 / 172) so each run ends on the closing line.", "method": "22 probe prompts at temp 1.0 across EN and zh-TW, correctness judged by hand, then cap tuning until the last line is the model's own closing, then a byte-for-byte diff of the embedded transcript against a fresh engine run", "findings": "Correct: 4-item lists, 3-item advice, 2-sentence child explanations ('gravity'), translation (good morning -> Bonjour!), one-sentence definitions, a Python function with docstring, 17x3=51 (then loops). Incorrect/incomplete: train word problem (never states 120 km), sky-blue (stutters and cut off), water cycle (stutters), zh-TW planet facts (wrong: Mercury called the farthest planet), zh-TW water cycle (invented a 'negative cycle'). Also confirmed the sampler already implements the model card's recommended config (temperature 1.0, top-k 64, top-p 0.95) per Unsloth's Gemma 3 guide, and the byte-diff caught a transcription typo (摄 vs 攝) plus a missing trailing space.", "next_action_hint": "Demos are at the 1B ceiling; pushing harder (word problems, multi-sentence summaries) reproduces stutters. Next useful work is elsewhere: 4B would need larger bss and would not fit the Pi in fp32 for an HF check."}}
