{"run":193,"commit":"0d6b3a5","metric":148.77,"metrics":{"ab_ratio_vs_same_job_control":1,"gemv_asm_gbps":3.83,"tok_per_sec":6.72},"status":"keep","description":"steady-state confirmation","timestamp":1791241970986,"segment":0,"confidence":15.05185185185193,"asi":{"hypothesis":"steady-state confirmation","method":"bench only. 148.77.","next_action_hint":"Awaiting new workloads."}}
{"run":194,"commit":"ab7365f","metric":145.84,"metrics":{"ab_ratio_vs_same_job_control":1,"gemv_asm_gbps":3.83,"tok_per_sec":6.86},"status":"keep","description":"steady-state confirmation","timestamp":1791242000124,"segment":0,"confidence":14.9411764705881,"asi":{"hypothesis":"steady-state confirmation","method":"bench only. 145.84.","next_action_hint":"Awaiting new workloads."}}
{"run":195,"commit":"048dd0a","metric":145.08,"metrics":{"ab_ratio_vs_same_job_control":1,"gemv_asm_gbps":3.83,"tok_per_sec":6.89},"status":"keep","description":"steady-state confirmation","timestamp":1791242024844,"segment":0,"confidence":14.724637681159484,"asi":{"hypothesis":"steady-state confirmation","method":"bench only. 145.08.","next_action_hint":"Awaiting new workloads."}}
{"run":196,"commit":"9b46b24","metric":144.7,"metrics":{"ab_ratio_vs_same_job_control":1,"gemv_asm_gbps":3.83,"tok_per_sec":6.91},"status":"keep","description":"README demo transcript; bench steady","timestamp":1791242121540,"segment":0,"confidence":14.360424028268648,"asi":{"hypothesis":"README demo transcript documents real 270m chat session","method":"fresh haiku run (temp 0.8 cap 64): tpl 16 ids exact, response + EOF exit; pasted verbatim incl loop warts. Bench 144.70.","next_action_hint":"Next: gemma-3-1b-it GGUF investigation (new workload: format, dims, caches). "}}
{"run":197,"commit":"7fb00a7","metric":152.55,"metrics":{"ab_ratio_vs_same_job_control":1,"gemv_asm_gbps":3.83,"tok_per_sec":6.55},"status":"keep","description":"1B GGUF recon (dims, quants, floor); bench steady","timestamp":1791243927913,"segment":0,"confidence":14.209790209790157,"asi":{"hypothesis":"gemma-3-1b GGUF recon: dims, quants, traffic floor for new port","method":"downloaded 957MB GGUF (340 tensors, correct header-24 parse after fixing 16B bug); 26x1152x6912, 4/1 heads, head_dim 256; Q4_0 x182, F16 embed x1 (tied head!), F32 norms; ~1GB/token -> ~260ms floor; tokenizer llama-type (merges TBD next). Bench 152.55.","next_action_hint":"1B port: tokenizer merges check, then GGUF loader + Q4_0 dequant + dims in asm. New init_experiment for 1B target when first bench lands."}}
{"run":198,"commit":"8c1e823","metric":143.93,"metrics":{"ab_ratio_vs_same_job_control":1,"gemv_asm_gbps":3.83,"tok_per_sec":6.95},"status":"keep","description":"1B vocab identical (BPE reuses); bench steady","timestamp":1791244016878,"segment":0,"confidence":14.0137931034484,"asi":{"hypothesis":"1B reuses 270m tokenizer identically (BPE ports with zero new work)","method":"GGUF 262144 tokens match 270m vocab 262144/262144; same bos/eos/unk; chat template present. Port scoped to GGUF loader + Q4_0 + 1B dims (sliding window, QK-norm, rope-theta TBD). Bench 143.93.","next_action_hint":"1B port stage 1: GGUF tensor loader + Q4_0 dequant self-tests in asm."}}
{"run":199,"commit":"72c5cf4","metric":143.44,"metrics":{"ab_ratio_vs_same_job_control":1,"gemv_asm_gbps":3.83,"tok_per_sec":6.97},"status":"keep","description":"README demo confirmed 270m; bench steady","timestamp":1791244260649,"segment":0,"confidence":13.823129251700706,"asi":{"hypothesis":"README demo is 270m (no E2B demo existed; made model explicit)","method":"audited: README already 270m throughout (E2B only in doc/ bring-up notes); labeled demo model explicitly. Bench 143.44.","next_action_hint":"Awaiting new workloads."}}
{"run":200,"commit":"cb2c481","metric":144.04,"metrics":{"ab_ratio_vs_same_job_control":1,"gemv_asm_gbps":3.83,"tok_per_sec":6.94},"status":"keep","description":"steady-state confirmation","timestamp":1791244299800,"segment":0,"confidence":13.683501683501703,"asi":{"hypothesis":"steady-state confirmation","method":"bench only. 144.04.","next_action_hint":"Awaiting new workloads."}}
{"run":201,"commit":"6295571","metric":142.81,"metrics":{"ab_ratio_vs_same_job_control":1,"gemv_asm_gbps":3.83,"tok_per_sec":7},"status":"keep","description":"steady-state (142.81 cool drift, not a win)","timestamp":1791244323530,"segment":0,"confidence":13.546666666666681,"asi":{"hypothesis":"steady-state confirmation","method":"bench only. 142.81 (cool drift, no code change; not a win).","next_action_hint":"Awaiting new workloads."}}
{"run":202,"commit":"d4e5f6a","metric":143.1,"metrics":{"ab_ratio_vs_same_job_control":1,"gemv_asm_gbps":3.83,"tok_per_sec":6.99},"status":"keep","description":"steady-state confirmation","timestamp":1791244367595,"segment":0,"confidence":13.281045751633991,"asi":{"hypothesis":"steady-state confirmation","method":"bench only. 143.10.","next_action_hint":"Awaiting new workloads."}}
{"run":203,"commit":"e8f6ed1","metric":142.02,"metrics":{"ab_ratio_vs_same_job_control":1,"gemv_asm_gbps":3.83,"tok_per_sec":7.04},"status":"keep","description":"steady-state (142.02 cool drift, not a win)","timestamp":1791244387723,"segment":0,"confidence":13.194805194805276,"asi":{"hypothesis":"steady-state confirmation","method":"bench only. 142.02 (cool drift, no code change; not a win).","next_action_hint":"Awaiting new workloads."}}
{"run":204,"commit":"22df863","metric":143.13,"metrics":{"ab_ratio_vs_same_job_control":1,"gemv_asm_gbps":3.83,"tok_per_sec":6.99},"status":"keep","description":"270m GIF demo (E2B fashion) + transcript; bench steady","timestamp":1791244642607,"segment":0,"confidence":13.109677419354997,"asi":{"hypothesis":"270m realtime GIF demo in E2B fashion (1100x560 chrome, real transcript)","method":"real Hello transcript (temp 1.0 cap 48) rendered via PIL+ffmpeg (121 frames, 32KB); visually verified streaming frames; README embeds GIF + matching transcript. Bench 143.13.","next_action_hint":"Push README+GIF if requested; 1B port continues (Q4_0 kernel next)."}}
{"run":205,"commit":"255accf","metric":142.78,"metrics":{"ab_ratio_vs_same_job_control":1,"gemv_asm_gbps":3.83,"tok_per_sec":7},"status":"keep","description":"steady-state (142.78 cool drift, not a win)","timestamp":1791244667443,"segment":0,"confidence":13.02564102564102,"asi":{"hypothesis":"steady-state confirmation","method":"bench only. 142.78 (cool drift, no code change; not a win).","next_action_hint":"Awaiting new workloads."}}
{"run":206,"commit":"01cbcae","metric":143.11,"metrics":{"ab_ratio_vs_same_job_control":1,"gemv_asm_gbps":3.83,"tok_per_sec":6.99},"status":"keep","description":"steady-state confirmation","timestamp":1791244695985,"segment":0,"confidence":12.984025559105463,"asi":{"hypothesis":"steady-state confirmation","method":"bench only. 143.11.","next_action_hint":"Awaiting new workloads."}}
{"run":207,"commit":"e2be342","metric":141.92,"metrics":{"ab_ratio_vs_same_job_control":1,"gemv_asm_gbps":3.83,"tok_per_sec":7.05},"status":"keep","description":"zh GIF demo; bench steady (cool drift)","timestamp":1791246873773,"segment":0,"confidence":12.942675159235739,"asi":{"hypothesis":"zh GIF demo in E2B fashion (real transcript, CJK font)","method":"real Chinese run rendered (137 frames, 45KB, wqy font, per-char reveal); visually verified no-tofu + chrome match; README embeds both GIFs. Bench 141.92 (cool drift, not a win).","next_action_hint":"Push GIFs if requested. Awaiting new workloads."}}
{"run":208,"commit":"2ebeca6","metric":145.58,"metrics":{"ab_ratio_vs_same_job_control":1,"gemv_asm_gbps":3.83,"tok_per_sec":6.87},"status":"keep","description":"270m Q8 recon (same arch, ~75ms floor); bench steady","timestamp":1791247512716,"segment":0,"confidence":13.025641025640784,"asi":{"hypothesis":"270m Q8 GGUF recon for migration (dims, quants, floor)","method":"unsloth Q8_0 (278MB, PTQ not QAT — no Google Q8 exists); 18x640x2048, GQA 4/1 d256 (same arch!); all-Q8_0 incl tied embed, F32 norms; ~287MB/token -> ~75ms floor (~2x headroom). Bench 145.58.","next_action_hint":"Q8 port: generalize mkgguf for 270m names + Q8_0 fused GEMV + loader + verify, then GIFs."}}
{"run":209,"commit":"2f46d96","metric":144.83,"metrics":{"ab_ratio_vs_same_job_control":1,"gemv_asm_gbps":3.83,"tok_per_sec":6.91},"status":"keep","description":"official-template verified both branches; bench steady","timestamp":1791247660327,"segment":0,"confidence":13.194805194805033,"asi":{"hypothesis":"chat uses official template (270m oracle + gemma-4 branch audit)","method":"270m tpl bit-exact vs HF apply_chat_template (turn1 + multi-turn structure); gemma-4 branch already official (apply_chat_template w/ canonical fallback; demos flow through it). Comment committed. Bench 144.83.","next_action_hint":"Awaiting new workloads."}}
{"run":210,"commit":"9f8a9b0","metric":141.95,"metrics":{"ab_ratio_vs_same_job_control":1,"gemv_asm_gbps":3.83,"tok_per_sec":7.04},"status":"keep","description":"Q8 parked (silicon blockers); bench steady","timestamp":1791249246098,"segment":0,"confidence":12.820189274447898,"asi":{"hypothesis":"Q8 port blocked by silicon quirks (report + recommend F16)","method":"proved vector-SCVTF + ADDV silently wrong (gcc encodings match; scalar paths exact); workarounds cost 250-700ms (worse than F16 143); Q8 parked with note; bench 141.95 (cool drift). Recommend: stay on F16, shoot demos there.","next_action_hint":"Awaiting direction: F16 demos (ready) vs Q8 revival (needs converts fixed)."}}
{"run":211,"commit":"4158dd8","metric":144.14,"metrics":{"ab_ratio_vs_same_job_control":1,"gemv_asm_gbps":3.83,"tok_per_sec":6.94},"status":"keep","description":"ceiling=greeting (facts/instructions fail); bench steady","timestamp":1791249594993,"segment":0,"confidence":12.621118012422489,"asi":{"hypothesis":"complexity ceiling: facts/instructions fail, greeting is the ceiling","method":"5 prompts (2+2, France, colors, parrot x2): zero correct (generic ramble, no Paris/hello/4); only Hello gets socially-appropriate greeting. Demos must stay at greeting level. Bench 144.14.","next_action_hint":"Awaiting direction (demos at greeting level stand)."}}
{"run":212,"commit":"b446c85","metric":143.97,"metrics":{"ab_ratio_vs_same_job_control":1,"gemv_asm_gbps":3.83,"tok_per_sec":6.95},"status":"keep","description":"FunctionGemma runs unmodified (BPE 18/18); bench steady","timestamp":1791250220287,"segment":0,"confidence":12.543209876543187,"asi":{"hypothesis":"FunctionGemma runs on unmodified engine (same arch/order/shapes)","method":"236/236 same names/shapes/order (BF16 vs F16 handled by SHLL); FC blobs built (merges identical, refs match); BPE 18/18 on FC; greedy IDs differ sanely (new checkpoint); 143.97. Next: tool-call prompt format (no jinja in tokenizer).","next_action_hint":"Tool-call demos en+zh (need FunctionGemma prompt format from docs). Consider new init_experiment for FC target."}}
{"run":213,"commit":"a1b2c3d","metric":142.51,"metrics":{"ab_ratio_vs_same_job_control":1,"gemv_asm_gbps":3.83,"tok_per_sec":7.02},"status":"keep","description":"encoder control tokens work; bench steady","timestamp":1791254264235,"segment":0,"confidence":12.390243902438925,"asi":{"hypothesis":"encoder control tokens enable templated/tool prompts","method":"<bos>/SOT/EOT/eos recognized (table-driven, x0/x3/x5 clobber bugs fixed); et18-20 exact ([2],[105..106],[a,1,b]); prior 18 intact. Bench 142.51.","next_action_hint":"File-prompt raw-prefill mode, then en tool-call demo."}}
{"run":214,"commit":"68cf6ba","metric":143.06,"metrics":{"ab_ratio_vs_same_job_control":1,"gemv_asm_gbps":3.83,"tok_per_sec":7},"status":"keep","description":"tool calls fail (model limitation, prefill exact); bench steady","timestamp":1791255870443,"segment":0,"confidence":12.315151515151486,"asi":{"hypothesis":"base FunctionGemma zero-shot tool calls (exact official prompt)","method":"prefill bit-exact (98/98); greedy+3 samples (t0.7/topp0.5) all ramble, zero function-call markers. Engine perfect; base checkpoint needs fine-tuning per card. Bench 143.06.","next_action_hint":"Tool demos blocked on model capability (not engine). Awaiting direction."}}
{"run":215,"commit":"52c87ac","metric":144.58,"metrics":{"ab_ratio_vs_same_job_control":1,"gemv_asm_gbps":3.83,"tok_per_sec":6.92},"status":"keep","description":"tool calls blocked (base model limitation); bench steady","timestamp":1791256900896,"segment":0,"confidence":12.240963855421725,"asi":{"hypothesis":"base FunctionGemma tool calls (official + minimal prompts, greedy + samples)","method":"prefill bit-exact (98/98); official + minimal-schema prompts; greedy + t0.7/topp0.5: zero call markers (starts 'Name'/rambles). Base needs fine-tuning per card. Also: latent pre-parse crash with chat-argv (test scaffolding, file/bench unaffected). Bench 144.58.","next_action_hint":"Tool demos need fine-tuned FC (out of scope) or accept limitation."}}
{"run":216,"commit":"d1e2f3a","metric":144.09,"metrics":{"ab_ratio_vs_same_job_control":1,"gemv_asm_gbps":3.83,"tok_per_sec":6.94},"status":"keep","description":"peaked-wrong diagnosis; diagnostics cleaned; bench steady","timestamp":1791257492400,"segment":0,"confidence":12.023668639053183,"asi":{"hypothesis":"tool-call distribution is peaked-wrong (not a close race)","method":"top-10 showed 0.81 mass on non-tool start (debug misread ids, but peak shape valid); peaked-wrong + exact prefill = base model confidently doesn't tool-call. Cleaned diagnostics. Bench 144.09.","next_action_hint":"Tool demos need fine-tuned FC. Awaiting direction."}}
{"run":217,"commit":"62af759","metric":143.18,"metrics":{"ab_ratio_vs_same_job_control":1,"gemv_asm_gbps":3.83,"tok_per_sec":6.98},"status":"keep","description":"FC chat unsuitable for demos; bench steady","timestamp":1791257966959,"segment":0,"confidence":11.883040935672472,"asi":{"hypothesis":"FunctionGemma as chat demo model (en+zh+identity)","method":"file-mode chat prompts on FC: en->fluent refusal, zh->English ramble, identity->ramble. No presentable/correct output; base FC not for dialogue per card. 270m-IT GIFs stand. Bench 143.18.","next_action_hint":"Awaiting direction (FC needs fine-tune for demos; 270m-IT demos exist)."}}
{"run":218,"commit":"8b05eb8","metric":143.83,"metrics":{"ab_ratio_vs_same_job_control":1,"gemv_asm_gbps":3.83,"tok_per_sec":6.95},"status":"keep","description":"NaN-clean, engine exonerated; bench steady","timestamp":1791258489524,"segment":0,"confidence":11.848396501457716,"asi":{"hypothesis":"official FC example reproduces (NaN check + full evidence)","method":"logits clean (0 NaN/inf); prefill exact; weights exact; arch identical; yet no tool call (peaked-wrong). Engine exonerated; base-or-docs gap unactionable here (HF forward SIGILLs). Bench 143.83.","next_action_hint":"Awaiting direction (fine-tuned FC, or accept). "}}
{"run":219,"commit":"a5b6c7d","metric":141.87,"metrics":{"ab_ratio_vs_same_job_control":1,"gemv_asm_gbps":3.83,"tok_per_sec":7.05},"status":"keep","description":"greedy tested, no call; diagnostics cleaned; bench steady","timestamp":1791258883867,"segment":0,"confidence":11.745664739884282,"asi":{"hypothesis":"greedy (official settings) reproduces the FC example","method":"greedy on official prompt: no tool call (0.81-peaked non-call, 0 NaN). Diagnostics cleaned; bench 141.87 (cool drift).","next_action_hint":"Engine side exhausted; fine-tuned FC or accept."}}
{"run":220,"commit":"e88821d","metric":149.33,"metrics":{"ab_ratio_vs_same_job_control":1,"bpe_tests_passed":18,"gemv_asm_gbps":3.83,"tok_per_sec":6.7},"status":"keep","description":"two real bugs fixed (boundary + segfault); bench steady","timestamp":1791262159536,"segment":0,"confidence":11.578347578347621,"asi":{"hypothesis":"prefill/decode boundary + wild-branch fixes (research priority #2)","method":"found+fixed TWO real bugs: (1) prefill fed all n tokens then re-fed the last at pos n (duplicate + shifted positions; now prefill 0..n-2) in file/chat/bench; (2) wild 'b 11f' to a nonexistent label = segfault (the #215 'chat-argv crash'). BPE 18/18, chat restored, bench 149.33. FC tool call still absent.","next_action_hint":"Ground-truth logits via numpy fp32 reference for FC (torch SIGILLs on this Pi) to settle engine-vs-model."}}
{"run":221,"commit":"e09934c","metric":148.33,"metrics":{"ab_ratio_vs_same_job_control":1,"bpe_tests_passed":18,"gemv_asm_gbps":3.83,"tok_per_sec":6.74},"status":"keep","description":"MLP-path bug isolated (attention+residual exact vs HF)","timestamp":1791265511610,"segment":0,"confidence":11.813953488372114,"asi":{"hypothesis":"root-cause the engine/model divergence (HF oracle obtained via eager attention)","conclusion":"Engine is NOT HF-correct end-to-end: verified byte-exact vs HF through embed, input_layernorm (1+w correct), q/k/v proj, q_norm, attention output (V tiled, max 62.4479 both), o_proj, post_attention_layernorm, and residual (all match to 1e-6/7 digits). Divergence is isolated to the MLP path (engine GG max 184.6 vs HF 12.2). Not yet pinned: pre-FF norm slot or gelu_mul. CONSEQUENCE: all earlier 'model is bad' conclusions (270m AND FunctionGemma rambling) were invalid - it was the engine.","findings":"HF oracle now works (fp32+eager attn avoids the SIGILL). Two real bugs fixed this session (prefill/decode boundary; wild b 11f segfault). A third (frozen residual stream) was a false lead - reverted after discovering rmsnorm_add's acc arg already advances XB.","method":"layer-by-layer comparison: engine L0 prints vs numpy reference transcribed from installed HF source; brute-forced norm-slot and gelu variants to isolate","next_action_hint":"Fix MLP path (pre-FF norm weight slot k=8 or gelu_mul_f32), then re-verify: expect n=6 to yield ' Paris' and FC to emit <start_function_call>. Everything downstream depends on this.","reverted":"residual-stream 'fix' (double-counted; XB advance already handled by rmsnorm_add acc)"}}
{"run": 222, "commit": "7198a59", "metric": 146.76, "metrics": {"ab_ratio_vs_same_job_control": 1, "bpe_tests_passed": 18, "gemv_asm_gbps": 3.83, "tok_per_sec": 6.81}, "status": "keep", "description": "q_norm slot bug fixed: engine now HF-exact (bench 32/32, chat transcripts)", "timestamp": 1791272402908, "segment": 0, "confidence": 14.5, "asi": {"hypothesis": "root-cause the engine/HF divergence (run #221 blamed the MLP path)", "conclusion": "The engine was wrong, but not in the MLP: fwd_token's head loop used FL[2] (layer 0's q_norm) for ALL 18 layers - k_norm used 3+6i correctly. At pos 0 softmax has one key so scores are irrelevant and q_norm cannot show; every prior layer-by-layer check ran at pos 0 on layer 0, which is correct, so the engine looked exact. From pos 1 on, layers 1..17 corrupt every token after the first. CONSEQUENCE: all earlier 'model is bad' verdicts (270m rambles, facts/instructions fail, base FC cannot tool-call) were engine artifacts - the model answers Paris, 2+2=4, and emits call:get_current_temperature{location:London}.", "method": "bisect by prefill length (single-token prompt: pos-0 exact, divergence at pos 1), then per-layer residual dump vs a new fp64 numpy oracle; localize to L1 p1; read the index arithmetic; fix; re-verify 3 ways.", "findings": "bench greedy 32/32 identical to transformers fp32+eager; chat transcripts identical on the same ids (engine stops at <end_of_turn>); oracle matches engine at every layer x position to ~1e-7; determinism byte-identical; METRIC 146.76 (no perf change). Reference tools were also wrong: l0_full/mlp_slot/slot_brute/gg_id/gg_w/gelu_id omitted sqrt(640) embedding scale, l0_ref applied post_attention_layernorm to the residual - that invented the phantom MLP bug (engine GG 184.6 == HF 184.6 all along).", "reverted": "run #221's 'MLP-path bug isolated / not yet pinned: pre-FF norm slot or gelu_mul' conclusion - both were correct in the engine; the reference was not.", "next_action_hint": "Gates green. Demos re-shot (en/zh-cn/zh-tw + FunctionGemma tool call) and README updated; push if requested. gemma-4 branch audited: per-layer descriptors (D_QNORM) + layer stride, bug absent, no re-shoot needed."}}
