{"run":82,"commit":"751065b","metric":145.02,"metrics":{"ab_ratio_vs_same_job_control":1,"gemv_asm_gbps":3.83,"tok_per_sec":6.9},"status":"keep","description":"steady-state confirmation","timestamp":1791239139092,"segment":0,"confidence":15.570881226053745,"asi":{"hypothesis":"steady-state confirmation","method":"bench only. 145.02.","next_action_hint":"Awaiting new workloads."}}
{"run":83,"commit":"106acc5","metric":147.18,"metrics":{"ab_ratio_vs_same_job_control":1,"gemv_asm_gbps":3.83,"tok_per_sec":6.79},"status":"keep","description":"steady-state confirmation","timestamp":1791239160239,"segment":0,"confidence":15.751937984496237,"asi":{"hypothesis":"steady-state confirmation","method":"bench only. 147.18.","next_action_hint":"Awaiting new workloads."}}
{"run":84,"commit":"969cfd3","metric":149.5,"metrics":{"ab_ratio_vs_same_job_control":1,"gemv_asm_gbps":3.83,"tok_per_sec":6.69},"status":"keep","description":"steady-state confirmation","timestamp":1791239185270,"segment":0,"confidence":15.570881226053745,"asi":{"hypothesis":"steady-state confirmation","method":"bench only. 149.50.","next_action_hint":"Awaiting new workloads."}}
{"run":85,"commit":"167a66e","metric":150.58,"metrics":{"ab_ratio_vs_same_job_control":1,"gemv_asm_gbps":3.83,"tok_per_sec":6.64},"status":"keep","description":"steady-state confirmation","timestamp":1791239206163,"segment":0,"confidence":15.278195488722004,"asi":{"hypothesis":"steady-state confirmation","method":"bench only. 150.58.","next_action_hint":"Awaiting new workloads."}}
{"run":86,"commit":"24d9bd7","metric":147.8,"metrics":{"ab_ratio_vs_same_job_control":1,"gemv_asm_gbps":3.83,"tok_per_sec":6.77},"status":"keep","description":"steady-state confirmation","timestamp":1791239222871,"segment":0,"confidence":15.570881226053745,"asi":{"hypothesis":"steady-state confirmation","method":"bench only. 147.80.","next_action_hint":"Awaiting new workloads."}}
{"run":87,"commit":"c7b0ef3","metric":153.35,"metrics":{"ab_ratio_vs_same_job_control":1,"gemv_asm_gbps":3.83,"tok_per_sec":6.52},"status":"keep","description":"steady-state (153.35, warm); no changes","timestamp":1791239243518,"segment":0,"confidence":15.278195488722004,"asi":{"hypothesis":"steady-state confirmation","method":"bench only. 153.35 (high end; likely heat after continuous runs, still under baseline; no code changed).","next_action_hint":"Awaiting new workloads."}}
{"run":88,"commit":"ac0ad87","metric":149.4,"metrics":{"ab_ratio_vs_same_job_control":1,"gemv_asm_gbps":3.83,"tok_per_sec":6.69},"status":"keep","description":"steady-state confirmation","timestamp":1791239266359,"segment":0,"confidence":15.05185185185193,"asi":{"hypothesis":"steady-state confirmation","method":"bench only. 149.40 (cooled from #87).","next_action_hint":"Awaiting new workloads."}}
{"run":89,"commit":"ba8be5e","metric":147.35,"metrics":{"ab_ratio_vs_same_job_control":1,"gemv_asm_gbps":3.83,"tok_per_sec":6.79},"status":"keep","description":"steady-state confirmation","timestamp":1791239293818,"segment":0,"confidence":15.278195488722004,"asi":{"hypothesis":"steady-state confirmation","method":"bench only. 147.35.","next_action_hint":"Awaiting new workloads."}}
{"run":90,"commit":"59cee95","metric":148.78,"metrics":{"ab_ratio_vs_same_job_control":1,"gemv_asm_gbps":3.83,"tok_per_sec":6.72},"status":"keep","description":"steady-state confirmation","timestamp":1791239322892,"segment":0,"confidence":15.691119691119686,"asi":{"hypothesis":"steady-state confirmation","method":"bench only. 148.78.","next_action_hint":"Awaiting new workloads."}}
{"run":91,"commit":"40fd7aa","metric":146.97,"metrics":{"ab_ratio_vs_same_job_control":1,"gemv_asm_gbps":3.83,"tok_per_sec":6.8},"status":"keep","description":"steady-state confirmation","timestamp":1791239343895,"segment":0,"confidence":15.875000000000004,"asi":{"hypothesis":"steady-state confirmation","method":"bench only. 146.97.","next_action_hint":"Awaiting new workloads."}}
{"run":92,"commit":"6d21b72","metric":147.28,"metrics":{"ab_ratio_vs_same_job_control":1,"gemv_asm_gbps":3.83,"tok_per_sec":6.79},"status":"keep","description":"steady-state confirmation","timestamp":1791239367991,"segment":0,"confidence":15.875000000000004,"asi":{"hypothesis":"steady-state confirmation","method":"bench only. 147.28.","next_action_hint":"Awaiting new workloads."}}
{"run":93,"commit":"09b6e32","metric":146.37,"metrics":{"ab_ratio_vs_same_job_control":1,"gemv_asm_gbps":3.83,"tok_per_sec":6.83},"status":"keep","description":"steady-state confirmation","timestamp":1791239395898,"segment":0,"confidence":15.751937984496237,"asi":{"hypothesis":"steady-state confirmation","method":"bench only. 146.37.","next_action_hint":"Awaiting new workloads."}}
{"run":94,"commit":"4e61a18","metric":146.71,"metrics":{"ab_ratio_vs_same_job_control":1,"gemv_asm_gbps":3.83,"tok_per_sec":6.82},"status":"keep","description":"steady-state confirmation","timestamp":1791239416975,"segment":0,"confidence":15.630769230769282,"asi":{"hypothesis":"steady-state confirmation","method":"bench only. 146.71.","next_action_hint":"Awaiting new workloads."}}
{"run":95,"commit":"676d484","metric":148.27,"metrics":{"ab_ratio_vs_same_job_control":1,"gemv_asm_gbps":3.83,"tok_per_sec":6.74},"status":"keep","description":"steady-state confirmation","timestamp":1791239437745,"segment":0,"confidence":15.875000000000004,"asi":{"hypothesis":"steady-state confirmation","method":"bench only. 148.27.","next_action_hint":"Awaiting new workloads."}}
{"run":96,"commit":"97959de","metric":148.47,"metrics":{"ab_ratio_vs_same_job_control":1,"gemv_asm_gbps":3.83,"tok_per_sec":6.74},"status":"keep","description":"steady-state confirmation","timestamp":1791239459024,"segment":0,"confidence":16.453441295546583,"asi":{"hypothesis":"steady-state confirmation","method":"bench only. 148.47.","next_action_hint":"Awaiting new workloads."}}
{"run":97,"commit":"0a699d5","metric":149.45,"metrics":{"ab_ratio_vs_same_job_control":1,"gemv_asm_gbps":3.83,"tok_per_sec":6.69},"status":"keep","description":"steady-state confirmation","timestamp":1791239481027,"segment":0,"confidence":15.999999999999888,"asi":{"hypothesis":"steady-state confirmation","method":"bench only. 149.45.","next_action_hint":"Awaiting new workloads."}}
{"run":98,"commit":"78b44fd","metric":146.58,"metrics":{"ab_ratio_vs_same_job_control":1,"gemv_asm_gbps":3.83,"tok_per_sec":6.82},"status":"keep","description":"steady-state confirmation","timestamp":1791239511262,"segment":0,"confidence":15.875000000000004,"asi":{"hypothesis":"steady-state confirmation","method":"bench only. 146.58.","next_action_hint":"Awaiting new workloads."}}
{"run":99,"commit":"b338919","metric":146.14,"metrics":{"ab_ratio_vs_same_job_control":1,"gemv_asm_gbps":3.83,"tok_per_sec":6.84},"status":"keep","description":"steady-state confirmation","timestamp":1791239538100,"segment":0,"confidence":15.751937984496237,"asi":{"hypothesis":"steady-state confirmation","method":"bench only. 146.14.","next_action_hint":"Awaiting new workloads."}}
{"run":100,"commit":"c6341e7","metric":146.93,"metrics":{"ab_ratio_vs_same_job_control":1,"gemv_asm_gbps":3.83,"tok_per_sec":6.81},"status":"keep","description":"steady-state confirmation","timestamp":1791239561606,"segment":0,"confidence":15.630769230769452,"asi":{"hypothesis":"steady-state confirmation","method":"bench only. 146.93.","next_action_hint":"Awaiting new workloads."}}
{"run":101,"commit":"0a613e2","metric":147.53,"metrics":{"ab_ratio_vs_same_job_control":1,"gemv_asm_gbps":3.83,"tok_per_sec":6.78},"status":"keep","description":"steady-state confirmation","timestamp":1791239586330,"segment":0,"confidence":15.875000000000004,"asi":{"hypothesis":"steady-state confirmation","method":"bench only. 147.53.","next_action_hint":"Awaiting new workloads."}}
{"run":102,"commit":"1fdc8dc","metric":147.13,"metrics":{"ab_ratio_vs_same_job_control":1,"gemv_asm_gbps":3.83,"tok_per_sec":6.8},"status":"keep","description":"steady-state confirmation","timestamp":1791239610492,"segment":0,"confidence":16.12698412698426,"asi":{"hypothesis":"steady-state confirmation","method":"bench only. 147.13.","next_action_hint":"Awaiting new workloads."}}
{"run":103,"commit":"5f70a94","metric":145.12,"metrics":{"ab_ratio_vs_same_job_control":1,"gemv_asm_gbps":3.83,"tok_per_sec":6.89},"status":"keep","description":"steady-state confirmation","timestamp":1791239631849,"segment":0,"confidence":16.12698412698426,"asi":{"hypothesis":"steady-state confirmation","method":"bench only. 145.12.","next_action_hint":"Awaiting new workloads."}}
{"run":104,"commit":"4f546aa","metric":145.92,"metrics":{"ab_ratio_vs_same_job_control":1,"gemv_asm_gbps":3.83,"tok_per_sec":6.85},"status":"keep","description":"steady-state confirmation","timestamp":1791239652845,"segment":0,"confidence":16.12698412698426,"asi":{"hypothesis":"steady-state confirmation","method":"bench only. 145.92.","next_action_hint":"Awaiting new workloads."}}
{"run":105,"commit":"1783794","metric":147.61,"metrics":{"ab_ratio_vs_same_job_control":1,"gemv_asm_gbps":3.83,"tok_per_sec":6.77},"status":"keep","description":"steady-state confirmation","timestamp":1791239688378,"segment":0,"confidence":16.38709677419382,"asi":{"hypothesis":"steady-state confirmation","method":"bench only. 147.61.","next_action_hint":"Awaiting new workloads."}}
{"run":106,"commit":"76bba4c","metric":145.5,"metrics":{"ab_ratio_vs_same_job_control":1,"gemv_asm_gbps":3.83,"tok_per_sec":6.87},"status":"keep","description":"steady-state confirmation","timestamp":1791239714365,"segment":0,"confidence":15.937254901961085,"asi":{"hypothesis":"steady-state confirmation","method":"bench only. 145.50.","next_action_hint":"Awaiting new workloads."}}
{"run":107,"commit":"f39de08","metric":144.36,"metrics":{"ab_ratio_vs_same_job_control":1,"gemv_asm_gbps":3.83,"tok_per_sec":6.93},"status":"keep","description":"steady-state confirmation","timestamp":1791239737130,"segment":0,"confidence":15.51145038167938,"asi":{"hypothesis":"steady-state confirmation","method":"bench only. 144.36.","next_action_hint":"Awaiting new workloads."}}
{"run":108,"commit":"8f038ab","metric":145.9,"metrics":{"ab_ratio_vs_same_job_control":1,"gemv_asm_gbps":3.83,"tok_per_sec":6.85},"status":"keep","description":"steady-state confirmation","timestamp":1791239761934,"segment":0,"confidence":14.886446886446958,"asi":{"hypothesis":"steady-state confirmation","method":"bench only. 145.90.","next_action_hint":"Awaiting new workloads."}}
{"run":109,"commit":"0f122ae","metric":147.47,"metrics":{"ab_ratio_vs_same_job_control":1,"gemv_asm_gbps":3.83,"tok_per_sec":6.78},"status":"keep","description":"steady-state confirmation","timestamp":1791239782993,"segment":0,"confidence":14.941176470588413,"asi":{"hypothesis":"steady-state confirmation","method":"bench only. 147.47.","next_action_hint":"Awaiting new workloads."}}
{"run":110,"commit":"fed50bf","metric":148.8,"metrics":{"ab_ratio_vs_same_job_control":1,"gemv_asm_gbps":3.83,"tok_per_sec":6.72},"status":"keep","description":"steady-state confirmation","timestamp":1791239801919,"segment":0,"confidence":15.51145038167938,"asi":{"hypothesis":"steady-state confirmation","method":"bench only. 148.80.","next_action_hint":"Awaiting new workloads."}}
{"run":111,"commit":"402d155","metric":147.25,"metrics":{"ab_ratio_vs_same_job_control":1,"gemv_asm_gbps":3.83,"tok_per_sec":6.79},"status":"keep","description":"steady-state confirmation","timestamp":1791239828436,"segment":0,"confidence":15.51145038167938,"asi":{"hypothesis":"steady-state confirmation","method":"bench only. 147.25.","next_action_hint":"Awaiting new workloads."}}
{"run":112,"commit":"d290b57","metric":154.94,"metrics":{"ab_ratio_vs_same_job_control":1,"gemv_asm_gbps":3.83,"tok_per_sec":6.45},"status":"keep","description":"steady-state (154.94, warm); no changes","timestamp":1791239855003,"segment":0,"confidence":15.51145038167938,"asi":{"hypothesis":"steady-state confirmation","method":"bench only. 154.94 (warm outlier; still under baseline; no changes).","next_action_hint":"Awaiting new workloads."}}
{"run":113,"commit":"07d9805","metric":144.13,"metrics":{"ab_ratio_vs_same_job_control":1,"gemv_asm_gbps":3.83,"tok_per_sec":6.94},"status":"keep","description":"steady-state confirmation","timestamp":1791239891585,"segment":0,"confidence":14.941176470588413,"asi":{"hypothesis":"steady-state confirmation","method":"bench only. 144.13 (cooled).","next_action_hint":"Awaiting new workloads."}}
{"run":114,"commit":"6b4cc4f","metric":146.17,"metrics":{"ab_ratio_vs_same_job_control":1,"gemv_asm_gbps":3.83,"tok_per_sec":6.84},"status":"keep","description":"steady-state confirmation","timestamp":1791239918049,"segment":0,"confidence":14.724637681159484,"asi":{"hypothesis":"steady-state confirmation","method":"bench only. 146.17.","next_action_hint":"Awaiting new workloads."}}
{"run":115,"commit":"f0a23b7","metric":144.23,"metrics":{"ab_ratio_vs_same_job_control":1,"gemv_asm_gbps":3.83,"tok_per_sec":6.93},"status":"keep","description":"steady-state confirmation","timestamp":1791239939179,"segment":0,"confidence":14.111111111111148,"asi":{"hypothesis":"steady-state confirmation","method":"bench only. 144.23.","next_action_hint":"Awaiting new workloads."}}
{"run":116,"commit":"98ed25f","metric":146.98,"metrics":{"ab_ratio_vs_same_job_control":1,"gemv_asm_gbps":3.83,"tok_per_sec":6.8},"status":"keep","description":"steady-state confirmation","timestamp":1791239958769,"segment":0,"confidence":14.360424028268648,"asi":{"hypothesis":"steady-state confirmation","method":"bench only. 146.98.","next_action_hint":"Awaiting new workloads."}}
{"run":117,"commit":"16a442d","metric":148.19,"metrics":{"ab_ratio_vs_same_job_control":1,"gemv_asm_gbps":3.83,"tok_per_sec":6.75},"status":"keep","description":"steady-state confirmation","timestamp":1791239977076,"segment":0,"confidence":14.618705035971383,"asi":{"hypothesis":"steady-state confirmation","method":"bench only. 148.19.","next_action_hint":"Awaiting new workloads."}}
{"run":118,"commit":"6dae8ed","metric":144.81,"metrics":{"ab_ratio_vs_same_job_control":1,"gemv_asm_gbps":3.83,"tok_per_sec":6.91},"status":"keep","description":"steady-state confirmation","timestamp":1791240005506,"segment":0,"confidence":14.360424028268648,"asi":{"hypothesis":"steady-state confirmation","method":"bench only. 144.81.","next_action_hint":"Awaiting new workloads."}}
{"run":119,"commit":"d2a8eac","metric":147.92,"metrics":{"ab_ratio_vs_same_job_control":1,"gemv_asm_gbps":3.83,"tok_per_sec":6.76},"status":"keep","description":"steady-state confirmation","timestamp":1791240037586,"segment":0,"confidence":14.618705035971383,"asi":{"hypothesis":"steady-state confirmation","method":"bench only. 147.92.","next_action_hint":"Awaiting new workloads."}}
{"run":120,"commit":"4d1bce1","metric":146.69,"metrics":{"ab_ratio_vs_same_job_control":1,"gemv_asm_gbps":3.83,"tok_per_sec":6.82},"status":"keep","description":"steady-state confirmation","timestamp":1791240056145,"segment":0,"confidence":15.05185185185193,"asi":{"hypothesis":"steady-state confirmation","method":"bench only. 146.69.","next_action_hint":"Awaiting new workloads."}}
{"run":121,"commit":"687ae51","metric":147.44,"metrics":{"ab_ratio_vs_same_job_control":1,"gemv_asm_gbps":3.83,"tok_per_sec":6.78},"status":"keep","description":"steady-state confirmation","timestamp":1791240079882,"segment":0,"confidence":15.511450381679715,"asi":{"hypothesis":"steady-state confirmation","method":"bench only. 147.44.","next_action_hint":"Awaiting new workloads."}}
{"run":122,"commit":"abbfd4e","metric":146.57,"metrics":{"ab_ratio_vs_same_job_control":1,"gemv_asm_gbps":3.83,"tok_per_sec":6.82},"status":"keep","description":"steady-state confirmation","timestamp":1791240102132,"segment":0,"confidence":15.630769230769282,"asi":{"hypothesis":"steady-state confirmation","method":"bench only. 146.57.","next_action_hint":"Awaiting new workloads."}}
{"run":123,"commit":"ccfdd21","metric":146.92,"metrics":{"ab_ratio_vs_same_job_control":1,"gemv_asm_gbps":3.83,"tok_per_sec":6.81},"status":"keep","description":"steady-state confirmation","timestamp":1791240121916,"segment":0,"confidence":15.75193798449589,"asi":{"hypothesis":"steady-state confirmation","method":"bench only. 146.92.","next_action_hint":"Awaiting new workloads."}}
{"run":124,"commit":"4a712a7","metric":147.24,"metrics":{"ab_ratio_vs_same_job_control":1,"gemv_asm_gbps":3.83,"tok_per_sec":6.79},"status":"keep","description":"steady-state confirmation","timestamp":1791240142922,"segment":0,"confidence":15.999999999999888,"asi":{"hypothesis":"steady-state confirmation","method":"bench only. 147.24.","next_action_hint":"Awaiting new workloads."}}
{"run":125,"commit":"633a8a8","metric":147.63,"metrics":{"ab_ratio_vs_same_job_control":1,"gemv_asm_gbps":3.83,"tok_per_sec":6.77},"status":"keep","description":"steady-state confirmation","timestamp":1791240159644,"segment":0,"confidence":16.520325203251804,"asi":{"hypothesis":"steady-state confirmation","method":"bench only. 147.63.","next_action_hint":"Awaiting new workloads."}}
{"run":126,"commit":"49284bc","metric":148.55,"metrics":{"ab_ratio_vs_same_job_control":1,"gemv_asm_gbps":3.83,"tok_per_sec":6.73},"status":"keep","description":"steady-state confirmation","timestamp":1791240178237,"segment":0,"confidence":16.724279835390917,"asi":{"hypothesis":"steady-state confirmation","method":"bench only. 148.55.","next_action_hint":"Awaiting new workloads."}}
{"run":127,"commit":"b5ee969","metric":148.11,"metrics":{"ab_ratio_vs_same_job_control":1,"gemv_asm_gbps":3.83,"tok_per_sec":6.75},"status":"keep","description":"steady-state confirmation","timestamp":1791240196050,"segment":0,"confidence":17.07563025210089,"asi":{"hypothesis":"steady-state confirmation","method":"bench only. 148.11.","next_action_hint":"Awaiting new workloads."}}
{"run":128,"commit":"64b8c28","metric":147.29,"metrics":{"ab_ratio_vs_same_job_control":1,"gemv_asm_gbps":3.83,"tok_per_sec":6.79},"status":"keep","description":"steady-state confirmation","timestamp":1791240217598,"segment":0,"confidence":16.933333333333312,"asi":{"hypothesis":"steady-state confirmation","method":"bench only. 147.29.","next_action_hint":"Awaiting new workloads."}}
{"run":129,"commit":"03ecda2","metric":148.12,"metrics":{"ab_ratio_vs_same_job_control":1,"gemv_asm_gbps":3.83,"tok_per_sec":6.75},"status":"keep","description":"steady-state confirmation","timestamp":1791240244533,"segment":0,"confidence":17.367521367521572,"asi":{"hypothesis":"steady-state confirmation","method":"bench only. 148.12.","next_action_hint":"Awaiting new workloads."}}
{"run":130,"commit":"4e4c265","metric":146.6,"metrics":{"ab_ratio_vs_same_job_control":1,"gemv_asm_gbps":3.83,"tok_per_sec":6.82},"status":"keep","description":"steady-state confirmation","timestamp":1791240295212,"segment":0,"confidence":17.36752136752136,"asi":{"hypothesis":"steady-state confirmation","method":"bench only. 146.60.","next_action_hint":"Awaiting new workloads."}}
{"run":131,"commit":"bf35505","metric":143.07,"metrics":{"ab_ratio_vs_same_job_control":1,"gemv_asm_gbps":3.83,"tok_per_sec":6.99},"status":"keep","description":"steady-state (143.07, cool)","timestamp":1791240321924,"segment":0,"confidence":16.93333333333351,"asi":{"hypothesis":"steady-state confirmation","method":"bench only. 143.07 (cool, near best).","next_action_hint":"Awaiting new workloads."}}
{"run":132,"commit":"bd21b35","metric":145.55,"metrics":{"ab_ratio_vs_same_job_control":1,"gemv_asm_gbps":3.83,"tok_per_sec":6.87},"status":"keep","description":"steady-state confirmation","timestamp":1791240344765,"segment":0,"confidence":16.86307053941913,"asi":{"hypothesis":"steady-state confirmation","method":"bench only. 145.55.","next_action_hint":"Awaiting new workloads."}}
{"run":133,"commit":"1ba966b","metric":147.73,"metrics":{"ab_ratio_vs_same_job_control":1,"gemv_asm_gbps":3.83,"tok_per_sec":6.77},"status":"keep","description":"steady-state confirmation","timestamp":1791240362760,"segment":0,"confidence":16.93333333333351,"asi":{"hypothesis":"steady-state confirmation","method":"bench only. 147.73.","next_action_hint":"Awaiting new workloads."}}
{"run":134,"commit":"a288c44","metric":145.48,"metrics":{"ab_ratio_vs_same_job_control":1,"gemv_asm_gbps":3.83,"tok_per_sec":6.87},"status":"keep","description":"steady-state confirmation","timestamp":1791240381339,"segment":0,"confidence":16.86307053941913,"asi":{"hypothesis":"steady-state confirmation","method":"bench only. 145.48.","next_action_hint":"Awaiting new workloads."}}
{"run":135,"commit":"0d697fb","metric":146.4,"metrics":{"ab_ratio_vs_same_job_control":1,"gemv_asm_gbps":3.83,"tok_per_sec":6.83},"status":"keep","description":"steady-state confirmation","timestamp":1791240400994,"segment":0,"confidence":17.07563025210089,"asi":{"hypothesis":"steady-state confirmation","method":"bench only. 146.40.","next_action_hint":"Awaiting new workloads."}}
{"run":136,"commit":"710f93b","metric":148.31,"metrics":{"ab_ratio_vs_same_job_control":1,"gemv_asm_gbps":3.83,"tok_per_sec":6.74},"status":"keep","description":"steady-state confirmation","timestamp":1791240431224,"segment":0,"confidence":17.1476793248945,"asi":{"hypothesis":"steady-state confirmation","method":"bench only. 148.31.","next_action_hint":"Awaiting new workloads."}}
{"run":137,"commit":"d98ca17","metric":147.9,"metrics":{"ab_ratio_vs_same_job_control":1,"gemv_asm_gbps":3.83,"tok_per_sec":6.76},"status":"keep","description":"steady-state confirmation","timestamp":1791240447029,"segment":0,"confidence":17.36752136752115,"asi":{"hypothesis":"steady-state confirmation","method":"bench only. 147.90.","next_action_hint":"Awaiting new workloads."}}
