{"run":138,"commit":"dd4c811","metric":151.26,"metrics":{"ab_ratio_vs_same_job_control":1,"gemv_asm_gbps":3.83,"tok_per_sec":6.61},"status":"keep","description":"steady-state (151.26, warm); no changes","timestamp":1791240464507,"segment":0,"confidence":17.07563025210089,"asi":{"hypothesis":"steady-state confirmation","method":"bench only. 151.26 (warm; still under baseline; no changes).","next_action_hint":"Awaiting new workloads."}}
{"run":139,"commit":"35f3d83","metric":151.17,"metrics":{"ab_ratio_vs_same_job_control":1,"gemv_asm_gbps":3.83,"tok_per_sec":6.62},"status":"keep","description":"steady-state (151.17, warm)","timestamp":1791240505441,"segment":0,"confidence":17.07563025210089,"asi":{"hypothesis":"steady-state confirmation","method":"bench only. 151.17 (still warm).","next_action_hint":"Awaiting new workloads."}}
{"run":140,"commit":"4ea2c60","metric":148.4,"metrics":{"ab_ratio_vs_same_job_control":1,"gemv_asm_gbps":3.83,"tok_per_sec":6.74},"status":"keep","description":"steady-state confirmation","timestamp":1791240522313,"segment":0,"confidence":17.36752136752136,"asi":{"hypothesis":"steady-state confirmation","method":"bench only. 148.40.","next_action_hint":"Awaiting new workloads."}}
{"run":141,"commit":"9728d5d","metric":159.07,"metrics":{"ab_ratio_vs_same_job_control":1,"gemv_asm_gbps":3.83,"tok_per_sec":6.29},"status":"keep","description":"steady-state (159.07, hot); no changes","timestamp":1791240544068,"segment":0,"confidence":17.36752136752115,"asi":{"hypothesis":"steady-state confirmation","method":"bench only. 159.07 — first reading above baseline; heat after sustained runs (prior warm spikes recovered on cooldown); no code changed, nothing to revert.","next_action_hint":"Awaiting new workloads; consider cooldown pauses if benchmarking resumes."}}
{"run":142,"commit":"1550caf","metric":146.86,"metrics":{"ab_ratio_vs_same_job_control":1,"gemv_asm_gbps":3.83,"tok_per_sec":6.81},"status":"keep","description":"steady-state (146.86, recovered)","timestamp":1791240564888,"segment":0,"confidence":17.36752136752136,"asi":{"hypothesis":"steady-state confirmation (post-heat recovery check)","method":"bench only. 146.86 — recovered from #141 heat as predicted; confirms heat diagnosis.","next_action_hint":"Awaiting new workloads."}}
{"run":143,"commit":"385f4cb","metric":148.06,"metrics":{"ab_ratio_vs_same_job_control":1,"gemv_asm_gbps":3.83,"tok_per_sec":6.75},"status":"keep","description":"steady-state confirmation","timestamp":1791240583376,"segment":0,"confidence":17.669565217391234,"asi":{"hypothesis":"steady-state confirmation","method":"bench only. 148.06.","next_action_hint":"Awaiting new workloads."}}
{"run":144,"commit":"bb9d145","metric":148.35,"metrics":{"ab_ratio_vs_same_job_control":1,"gemv_asm_gbps":3.83,"tok_per_sec":6.74},"status":"keep","description":"steady-state confirmation","timestamp":1791240601564,"segment":0,"confidence":18.142857142856858,"asi":{"hypothesis":"steady-state confirmation","method":"bench only. 148.35.","next_action_hint":"Awaiting new workloads."}}
{"run":145,"commit":"0c8b199","metric":147.31,"metrics":{"ab_ratio_vs_same_job_control":1,"gemv_asm_gbps":3.83,"tok_per_sec":6.79},"status":"keep","description":"steady-state confirmation","timestamp":1791240622901,"segment":0,"confidence":18.3063063063061,"asi":{"hypothesis":"steady-state confirmation","method":"bench only. 147.31.","next_action_hint":"Awaiting new workloads."}}
{"run":146,"commit":"29ae496","metric":150.86,"metrics":{"ab_ratio_vs_same_job_control":1,"gemv_asm_gbps":3.83,"tok_per_sec":6.63},"status":"keep","description":"steady-state (150.86, warm-ish)","timestamp":1791240684341,"segment":0,"confidence":18.142857142856858,"asi":{"hypothesis":"steady-state confirmation","method":"bench only. 150.86 (warm-ish).","next_action_hint":"Awaiting new workloads."}}
{"run":147,"commit":"68c2d52","metric":148.14,"metrics":{"ab_ratio_vs_same_job_control":1,"gemv_asm_gbps":3.83,"tok_per_sec":6.75},"status":"keep","description":"steady-state confirmation","timestamp":1791240703970,"segment":0,"confidence":18.642201834862348,"asi":{"hypothesis":"steady-state confirmation","method":"bench only. 148.14.","next_action_hint":"Awaiting new workloads."}}
{"run":148,"commit":"ccdf53f","metric":147.56,"metrics":{"ab_ratio_vs_same_job_control":1,"gemv_asm_gbps":3.83,"tok_per_sec":6.78},"status":"keep","description":"steady-state confirmation","timestamp":1791240740178,"segment":0,"confidence":18.728110599078224,"asi":{"hypothesis":"steady-state confirmation","method":"bench only. 147.56.","next_action_hint":"Awaiting new workloads."}}
{"run":149,"commit":"c0b1490","metric":144.16,"metrics":{"ab_ratio_vs_same_job_control":1,"gemv_asm_gbps":3.83,"tok_per_sec":6.94},"status":"keep","description":"steady-state confirmation","timestamp":1791240767031,"segment":0,"confidence":18.3063063063061,"asi":{"hypothesis":"steady-state confirmation","method":"bench only. 144.16.","next_action_hint":"Awaiting new workloads."}}
{"run":150,"commit":"c1840c3","metric":143.96,"metrics":{"ab_ratio_vs_same_job_control":1,"gemv_asm_gbps":3.83,"tok_per_sec":6.95},"status":"keep","description":"steady-state confirmation","timestamp":1791240802273,"segment":0,"confidence":17.82456140350878,"asi":{"hypothesis":"steady-state confirmation","method":"bench only. 143.96.","next_action_hint":"Awaiting new workloads."}}
{"run":151,"commit":"3efc22d","metric":146.91,"metrics":{"ab_ratio_vs_same_job_control":1,"gemv_asm_gbps":3.83,"tok_per_sec":6.81},"status":"keep","description":"steady-state confirmation","timestamp":1791240825197,"segment":0,"confidence":17.982300884955844,"asi":{"hypothesis":"steady-state confirmation","method":"bench only. 146.91.","next_action_hint":"Awaiting new workloads."}}
{"run":152,"commit":"7db29e6","metric":145.04,"metrics":{"ab_ratio_vs_same_job_control":1,"gemv_asm_gbps":3.83,"tok_per_sec":6.89},"status":"keep","description":"steady-state confirmation","timestamp":1791240846512,"segment":0,"confidence":17.36752136752136,"asi":{"hypothesis":"steady-state confirmation","method":"bench only. 145.04.","next_action_hint":"Awaiting new workloads."}}
{"run":153,"commit":"a7e4b9b","metric":145.48,"metrics":{"ab_ratio_vs_same_job_control":1,"gemv_asm_gbps":3.83,"tok_per_sec":6.87},"status":"keep","description":"steady-state confirmation","timestamp":1791240867266,"segment":0,"confidence":17.36752136752115,"asi":{"hypothesis":"steady-state confirmation","method":"bench only. 145.48.","next_action_hint":"Awaiting new workloads."}}
{"run":154,"commit":"7bf9c7b","metric":148.71,"metrics":{"ab_ratio_vs_same_job_control":1,"gemv_asm_gbps":3.83,"tok_per_sec":6.72},"status":"keep","description":"steady-state confirmation","timestamp":1791240890937,"segment":0,"confidence":17.36752136752136,"asi":{"hypothesis":"steady-state confirmation","method":"bench only. 148.71.","next_action_hint":"Awaiting new workloads."}}
{"run":155,"commit":"0e72e76","metric":143.01,"metrics":{"ab_ratio_vs_same_job_control":1,"gemv_asm_gbps":3.83,"tok_per_sec":6.99},"status":"keep","description":"steady-state (143.01, near best)","timestamp":1791240949857,"segment":0,"confidence":17.36752136752115,"asi":{"hypothesis":"steady-state confirmation","method":"bench only. 143.01 (near best 143.02, cool).","next_action_hint":"Awaiting new workloads."}}
{"run":156,"commit":"006d7c4","metric":143.87,"metrics":{"ab_ratio_vs_same_job_control":1,"gemv_asm_gbps":3.83,"tok_per_sec":6.95},"status":"keep","description":"steady-state confirmation","timestamp":1791240999089,"segment":0,"confidence":17.1476793248945,"asi":{"hypothesis":"steady-state confirmation","method":"bench only. 143.87.","next_action_hint":"Awaiting new workloads."}}
{"run":157,"commit":"9722839","metric":142.89,"metrics":{"ab_ratio_vs_same_job_control":1,"gemv_asm_gbps":3.83,"tok_per_sec":7},"status":"keep","description":"steady-state (142.89 numeric low by drift, not a win)","timestamp":1791241057988,"segment":0,"confidence":17.07563025210089,"asi":{"hypothesis":"steady-state confirmation","method":"bench only. 142.89 — new numeric low but NO code change (cool drift, cf 143.01); not a real improvement, do not treat as win.","next_action_hint":"Awaiting new workloads."}}
{"run":158,"commit":"8984754","metric":143.26,"metrics":{"ab_ratio_vs_same_job_control":1,"gemv_asm_gbps":3.83,"tok_per_sec":6.98},"status":"keep","description":"steady-state confirmation","timestamp":1791241078831,"segment":0,"confidence":16.86307053941913,"asi":{"hypothesis":"steady-state confirmation","method":"bench only. 143.26.","next_action_hint":"Awaiting new workloads."}}
{"run":159,"commit":"8a6d296","metric":142.75,"metrics":{"ab_ratio_vs_same_job_control":1,"gemv_asm_gbps":3.83,"tok_per_sec":7.01},"status":"keep","description":"steady-state (142.75 cool drift, not a win)","timestamp":1791241110828,"segment":0,"confidence":16.520325203252188,"asi":{"hypothesis":"steady-state confirmation","method":"bench only. 142.75 (cool drift again, no code change; not a win).","next_action_hint":"Awaiting new workloads."}}
{"run":160,"commit":"ee1c76b","metric":145.37,"metrics":{"ab_ratio_vs_same_job_control":1,"gemv_asm_gbps":3.83,"tok_per_sec":6.88},"status":"keep","description":"steady-state confirmation","timestamp":1791241132113,"segment":0,"confidence":16.256000000000203,"asi":{"hypothesis":"steady-state confirmation","method":"bench only. 145.37.","next_action_hint":"Awaiting new workloads."}}
{"run":161,"commit":"dda593e","metric":143.37,"metrics":{"ab_ratio_vs_same_job_control":1,"gemv_asm_gbps":3.83,"tok_per_sec":6.98},"status":"keep","description":"steady-state confirmation","timestamp":1791241153480,"segment":0,"confidence":15.999999999999888,"asi":{"hypothesis":"steady-state confirmation","method":"bench only. 143.37.","next_action_hint":"Awaiting new workloads."}}
{"run":162,"commit":"2558b14","metric":144.67,"metrics":{"ab_ratio_vs_same_job_control":1,"gemv_asm_gbps":3.83,"tok_per_sec":6.91},"status":"keep","description":"steady-state confirmation","timestamp":1791241174776,"segment":0,"confidence":15.691119691119686,"asi":{"hypothesis":"steady-state confirmation","method":"bench only. 144.67.","next_action_hint":"Awaiting new workloads."}}
{"run":163,"commit":"ceb5804","metric":143.3,"metrics":{"ab_ratio_vs_same_job_control":1,"gemv_asm_gbps":3.83,"tok_per_sec":6.98},"status":"keep","description":"steady-state confirmation","timestamp":1791241196408,"segment":0,"confidence":15.51145038167938,"asi":{"hypothesis":"steady-state confirmation","method":"bench only. 143.30.","next_action_hint":"Awaiting new workloads."}}
{"run":164,"commit":"9f399c3","metric":146.57,"metrics":{"ab_ratio_vs_same_job_control":1,"gemv_asm_gbps":3.83,"tok_per_sec":6.82},"status":"keep","description":"steady-state confirmation","timestamp":1791241218021,"segment":0,"confidence":15.751937984496065,"asi":{"hypothesis":"steady-state confirmation","method":"bench only. 146.57.","next_action_hint":"Awaiting new workloads."}}
{"run":165,"commit":"4a5d19b","metric":146.06,"metrics":{"ab_ratio_vs_same_job_control":1,"gemv_asm_gbps":3.83,"tok_per_sec":6.85},"status":"keep","description":"steady-state confirmation","timestamp":1791241273464,"segment":0,"confidence":15.630769230769111,"asi":{"hypothesis":"steady-state confirmation","method":"bench only. 146.06.","next_action_hint":"Awaiting new workloads."}}
{"run":166,"commit":"f496ddf","metric":143.55,"metrics":{"ab_ratio_vs_same_job_control":1,"gemv_asm_gbps":3.83,"tok_per_sec":6.97},"status":"keep","description":"steady-state confirmation","timestamp":1791241307376,"segment":0,"confidence":15.335849056603758,"asi":{"hypothesis":"steady-state confirmation","method":"bench only. 143.55.","next_action_hint":"Awaiting new workloads."}}
{"run":167,"commit":"c3569b2","metric":144.58,"metrics":{"ab_ratio_vs_same_job_control":1,"gemv_asm_gbps":3.83,"tok_per_sec":6.92},"status":"keep","description":"steady-state confirmation","timestamp":1791241329052,"segment":0,"confidence":14.9411764705881,"asi":{"hypothesis":"steady-state confirmation","method":"bench only. 144.58.","next_action_hint":"Awaiting new workloads."}}
{"run":168,"commit":"85df01d","metric":143.84,"metrics":{"ab_ratio_vs_same_job_control":1,"gemv_asm_gbps":3.83,"tok_per_sec":6.95},"status":"keep","description":"steady-state confirmation","timestamp":1791241365273,"segment":0,"confidence":14.618705035970933,"asi":{"hypothesis":"steady-state confirmation","method":"bench only. 143.84.","next_action_hint":"Awaiting new workloads."}}
{"run":169,"commit":"f26b3fb","metric":144.67,"metrics":{"ab_ratio_vs_same_job_control":1,"gemv_asm_gbps":3.83,"tok_per_sec":6.91},"status":"keep","description":"steady-state confirmation","timestamp":1791241392977,"segment":0,"confidence":14.514285714285672,"asi":{"hypothesis":"steady-state confirmation","method":"bench only. 144.67.","next_action_hint":"Awaiting new workloads."}}
{"run":170,"commit":"8b2b7d2","metric":145.59,"metrics":{"ab_ratio_vs_same_job_control":1,"gemv_asm_gbps":3.83,"tok_per_sec":6.87},"status":"keep","description":"steady-state confirmation","timestamp":1791241437984,"segment":0,"confidence":14.411347517730547,"asi":{"hypothesis":"steady-state confirmation","method":"bench only. 145.59.","next_action_hint":"Awaiting new workloads."}}
{"run":171,"commit":"c522a71","metric":143.22,"metrics":{"ab_ratio_vs_same_job_control":1,"gemv_asm_gbps":3.83,"tok_per_sec":6.98},"status":"keep","description":"steady-state confirmation","timestamp":1791241459262,"segment":0,"confidence":14.309859154929718,"asi":{"hypothesis":"steady-state confirmation","method":"bench only. 143.22.","next_action_hint":"Awaiting new workloads."}}
{"run":172,"commit":"448b392","metric":143.72,"metrics":{"ab_ratio_vs_same_job_control":1,"gemv_asm_gbps":3.83,"tok_per_sec":6.96},"status":"keep","description":"steady-state confirmation","timestamp":1791241480646,"segment":0,"confidence":14.309859154929576,"asi":{"hypothesis":"steady-state confirmation","method":"bench only. 143.72.","next_action_hint":"Awaiting new workloads."}}
{"run":173,"commit":"5c51929","metric":142.82,"metrics":{"ab_ratio_vs_same_job_control":1,"gemv_asm_gbps":3.83,"tok_per_sec":7},"status":"keep","description":"steady-state (142.82 cool drift, not a win)","timestamp":1791241501969,"segment":0,"confidence":14.209790209790157,"asi":{"hypothesis":"steady-state confirmation","method":"bench only. 142.82 (cool drift, no code change; not a win).","next_action_hint":"Awaiting new workloads."}}
{"run":174,"commit":"179b4de","metric":143.79,"metrics":{"ab_ratio_vs_same_job_control":1,"gemv_asm_gbps":3.83,"tok_per_sec":6.95},"status":"keep","description":"steady-state confirmation","timestamp":1791241523640,"segment":0,"confidence":14.111111111111148,"asi":{"hypothesis":"steady-state confirmation","method":"bench only. 143.79.","next_action_hint":"Awaiting new workloads."}}
{"run":175,"commit":"f73cfaa","metric":143.78,"metrics":{"ab_ratio_vs_same_job_control":1,"gemv_asm_gbps":3.83,"tok_per_sec":6.96},"status":"keep","description":"steady-state confirmation","timestamp":1791241544876,"segment":0,"confidence":14.111111111111148,"asi":{"hypothesis":"steady-state confirmation","method":"bench only. 143.78.","next_action_hint":"Awaiting new workloads."}}
{"run":176,"commit":"18a595a","metric":146.1,"metrics":{"ab_ratio_vs_same_job_control":1,"gemv_asm_gbps":3.83,"tok_per_sec":6.84},"status":"keep","description":"steady-state confirmation","timestamp":1791241566676,"segment":0,"confidence":14.111111111111148,"asi":{"hypothesis":"steady-state confirmation","method":"bench only. 146.10.","next_action_hint":"Awaiting new workloads."}}
{"run":177,"commit":"dbfda4c","metric":144.71,"metrics":{"ab_ratio_vs_same_job_control":1,"gemv_asm_gbps":3.83,"tok_per_sec":6.91},"status":"keep","description":"steady-state confirmation","timestamp":1791241610629,"segment":0,"confidence":14.013793103448126,"asi":{"hypothesis":"steady-state confirmation","method":"bench only. 144.71.","next_action_hint":"Awaiting new workloads."}}
{"run":178,"commit":"090f702","metric":144.77,"metrics":{"ab_ratio_vs_same_job_control":1,"gemv_asm_gbps":3.83,"tok_per_sec":6.91},"status":"keep","description":"steady-state confirmation","timestamp":1791241632642,"segment":0,"confidence":13.776271186440614,"asi":{"hypothesis":"steady-state confirmation","method":"bench only. 144.77.","next_action_hint":"Awaiting new workloads."}}
{"run":179,"commit":"0626882","metric":146.22,"metrics":{"ab_ratio_vs_same_job_control":1,"gemv_asm_gbps":3.83,"tok_per_sec":6.84},"status":"keep","description":"steady-state confirmation","timestamp":1791241653653,"segment":0,"confidence":13.91780821917802,"asi":{"hypothesis":"steady-state confirmation","method":"bench only. 146.22.","next_action_hint":"Awaiting new workloads."}}
{"run":180,"commit":"25e9bd2","metric":146.77,"metrics":{"ab_ratio_vs_same_job_control":1,"gemv_asm_gbps":3.83,"tok_per_sec":6.81},"status":"keep","description":"steady-state confirmation","timestamp":1791241675275,"segment":0,"confidence":13.917808219177886,"asi":{"hypothesis":"steady-state confirmation","method":"bench only. 146.77.","next_action_hint":"Awaiting new workloads."}}
{"run":181,"commit":"b845969","metric":146.7,"metrics":{"ab_ratio_vs_same_job_control":1,"gemv_asm_gbps":3.83,"tok_per_sec":6.82},"status":"keep","description":"steady-state confirmation","timestamp":1791241696620,"segment":0,"confidence":13.91780821917802,"asi":{"hypothesis":"steady-state confirmation","method":"bench only. 146.70.","next_action_hint":"Awaiting new workloads."}}
{"run":182,"commit":"d355fdd","metric":146.24,"metrics":{"ab_ratio_vs_same_job_control":1,"gemv_asm_gbps":3.83,"tok_per_sec":6.84},"status":"keep","description":"steady-state confirmation","timestamp":1791241719310,"segment":0,"confidence":14.160278745644591,"asi":{"hypothesis":"steady-state confirmation","method":"bench only. 146.24.","next_action_hint":"Awaiting new workloads."}}
{"run":183,"commit":"13bdf1d","metric":146.74,"metrics":{"ab_ratio_vs_same_job_control":1,"gemv_asm_gbps":3.83,"tok_per_sec":6.81},"status":"keep","description":"steady-state confirmation","timestamp":1791241741042,"segment":0,"confidence":14.411347517730547,"asi":{"hypothesis":"steady-state confirmation","method":"bench only. 146.74.","next_action_hint":"Awaiting new workloads."}}
{"run":184,"commit":"a503fbb","metric":146.37,"metrics":{"ab_ratio_vs_same_job_control":1,"gemv_asm_gbps":3.83,"tok_per_sec":6.83},"status":"keep","description":"steady-state confirmation","timestamp":1791241761080,"segment":0,"confidence":14.360424028268792,"asi":{"hypothesis":"steady-state confirmation","method":"bench only. 146.37.","next_action_hint":"Awaiting new workloads."}}
{"run":185,"commit":"2b6c284","metric":147.72,"metrics":{"ab_ratio_vs_same_job_control":1,"gemv_asm_gbps":3.83,"tok_per_sec":6.77},"status":"keep","description":"steady-state confirmation","timestamp":1791241782425,"segment":0,"confidence":14.618705035971383,"asi":{"hypothesis":"steady-state confirmation","method":"bench only. 147.72.","next_action_hint":"Awaiting new workloads."}}
{"run":186,"commit":"d8368ab","metric":147.93,"metrics":{"ab_ratio_vs_same_job_control":1,"gemv_asm_gbps":3.83,"tok_per_sec":6.76},"status":"keep","description":"steady-state confirmation","timestamp":1791241803668,"segment":0,"confidence":14.671480144404445,"asi":{"hypothesis":"steady-state confirmation","method":"bench only. 147.93.","next_action_hint":"Awaiting new workloads."}}
{"run":187,"commit":"10dd5d5","metric":146.02,"metrics":{"ab_ratio_vs_same_job_control":1,"gemv_asm_gbps":3.83,"tok_per_sec":6.85},"status":"keep","description":"steady-state confirmation","timestamp":1791241825862,"segment":0,"confidence":14.724637681159484,"asi":{"hypothesis":"steady-state confirmation","method":"bench only. 146.02.","next_action_hint":"Awaiting new workloads."}}
{"run":188,"commit":"48ebf77","metric":147.85,"metrics":{"ab_ratio_vs_same_job_control":1,"gemv_asm_gbps":3.83,"tok_per_sec":6.76},"status":"keep","description":"steady-state confirmation","timestamp":1791241847588,"segment":0,"confidence":14.778181818181833,"asi":{"hypothesis":"steady-state confirmation","method":"bench only. 147.85.","next_action_hint":"Awaiting new workloads."}}
{"run":189,"commit":"aeb6e86","metric":147.06,"metrics":{"ab_ratio_vs_same_job_control":1,"gemv_asm_gbps":3.83,"tok_per_sec":6.8},"status":"keep","description":"steady-state confirmation","timestamp":1791241868548,"segment":0,"confidence":14.832116788321134,"asi":{"hypothesis":"steady-state confirmation","method":"bench only. 147.06.","next_action_hint":"Awaiting new workloads."}}
{"run":190,"commit":"948ce0c","metric":144.88,"metrics":{"ab_ratio_vs_same_job_control":1,"gemv_asm_gbps":3.83,"tok_per_sec":6.9},"status":"keep","description":"steady-state confirmation","timestamp":1791241905784,"segment":0,"confidence":14.778181818181833,"asi":{"hypothesis":"steady-state confirmation","method":"bench only. 144.88.","next_action_hint":"Awaiting new workloads."}}
{"run":191,"commit":"f0503cf","metric":146.74,"metrics":{"ab_ratio_vs_same_job_control":1,"gemv_asm_gbps":3.83,"tok_per_sec":6.81},"status":"keep","description":"steady-state confirmation","timestamp":1791241928107,"segment":0,"confidence":15.05185185185193,"asi":{"hypothesis":"steady-state confirmation","method":"bench only. 146.74.","next_action_hint":"Awaiting new workloads."}}
{"run":192,"commit":"f67761f","metric":146.13,"metrics":{"ab_ratio_vs_same_job_control":1,"gemv_asm_gbps":3.83,"tok_per_sec":6.84},"status":"keep","description":"steady-state confirmation","timestamp":1791241949479,"segment":0,"confidence":14.9411764705881,"asi":{"hypothesis":"steady-state confirmation","method":"bench only. 146.13.","next_action_hint":"Awaiting new workloads."}}
